Name,Category,Bio,Aliases,Flights,Documents,Connections,In Black Book,Nationality
Glen Dubin,business,"Highbridge Capital co-founder; flight logs, black book; named in Giuffre deposition; wife Eva facilitated Epstein's hedge fund access per February 2026 Bloomberg investigation.",Glen R. Dubin; Glenn Dubin,0,1936,0,Yes,American
Glen Ritchie,associate,Contact listed in Epstein's black book.,,0,70,0,Yes,British
Glenn Straub,business,Palm Beach real estate developer; on DOJ 305 list; geographic overlap with Epstein's properties.,Straub,0,18,0,No,American
Gordon Brown,politician,Former UK PM; named in Mandelson-Epstein emails; confidential memos forwarded to Epstein.,,0,110,0,No,British
Graydon Carter,other,Former Vanity Fair editor listed in Epstein's black book.,,0,232,0,Yes,Canadian-American
Greg Norman,celebrity,"Australian golf champion, two-time Open winner, and former LIV Golf CEO listed in Epstein's black book.",Gregory John Norman; Gregory Norman,0,129,0,Yes,Australian
Greg Wyler,other,"Founder of OneWeb satellite network; Epstein acted as informal fundraising adviser during OneWeb's 2012-2014 formation, with shared jet rides and extensive email correspondence documented in EFTA files.",Gregory Wyler,0,1546,0,No,
Griffin Dunne,celebrity,Actor known for An American Werewolf in London and After Hours; director; listed in Epstein's black book.,,0,25,0,Yes,American
Guerman Aliev,business,Russian-born CEO of Altpoint Capital (fka Stone Tower),German Aliev,0,22,0,No,
Gunhild Stordalen,academic,Norwegian physician/philanthropist; named in Norwegian Epstein scandal context.,,0,0,0,No,Norwegian
Guo Wengui,business,Chinese oligarch; alleged $1M business relationship with Bannon per FBI 302.,Miles Kwok; Miles Guo,0,17,0,No,Chinese
Guy Dellal,business,Property developer listed in Epstein's black book.,,0,0,0,Yes,British
Guy Lewis,legal,Former U.S. Attorney during early Epstein investigation.,,0,198,0,No,American
Guy Riordan,associate,Albuquerque Banker,,0,12,0,No,
Guy Vicars,other,Barge asssistant at Epstein's Island.,,0,111,0,No,
Guzel Ganieva,other,Moscow model whose FSB intelligence file was obtained by Epstein through Sergei Belyakov within 72 hours of a request.,Maria Guchapsheva,0,0,0,No,Russian
Haddon Morgan Foreman,associate,Denver criminal defense law firm whose partner Laura Menninger served as defense counsel for Ghislaine Maxwell in the federal sex trafficking trial.,Foreman; Haddon Foreman,0,466,0,No,
Hans Peterson,associate,Individual whose extradition to the US was denied by France in 2007.,,0,59,0,No,
Hardeep Singh Puri,politician,Indian politician who met Epstein at Manhattan townhouse three times.,Hardeep Puri,0,234,0,No,Indian
Harry Beller,business,HBRK Associates accountant; managed Epstein's COUQ Foundation; handled JP Morgan accounts and wire transfers.,,0,10468,0,No,
Harry Fisch,academic,"American urologist, professor emeritus at Weill Cornell Medicine, and co-founder of Veru Pharma. Served as Jeffrey Epstein's personal physician and maintained a medical relationship with Epstein over multiple years. Fisch appears in Epstein's address records and correspondence, and his role as Epstein's doctor was referenced in legal proceedings following Epstein's 2019 arrest. He is a published author on male reproductive health and ran a private urology practice in New York City.",,0,477,0,No,
Hasnat Khan,other,Heart surgeon listed in Epstein's black book.,Dr. Hasnat Khan,0,116,0,Yes,British-Pakistani
Hassanal Bolkiah,other,Sultan of Brunei,,0,6,0,No,
Helena Bonham Carter,celebrity,"British actress (Fight Club, Harry Potter); listed in Epstein's black book via British social circles; no allegations.",Carter; Helena Carter,0,37,0,Yes,British
Helena Christensen,celebrity,"Danish supermodel, Victoria's Secret Angel, Nylon co-founder; listed in Epstein's black book.",,0,27,0,Yes,Danish
Henry Kravis,business,Co-founder of KKR listed in Epstein's black book.,Henry Robert Kravis,0,108,0,Yes,American
Henry Pittman,associate,United States Magistrate Judge presiding over the bail hearing.,,0,23,0,No,
Herbert Allen,business,Allen & Company CEO; Sun Valley Conference host; mentioned by Epstein.,Herbert Allen Jr.,0,5,0,No,American
Herick Rodriguez,other,OBM International architect who visited Epstein island for site assessment (April 2018),Herick Rodrigue,0,15,0,No,
Hilian Bedminister,associate,Painter at LSJ,,0,31,0,No,
Hillary Clinton,politician,"Former Secretary of State and 2016 presidential nominee; testified under subpoena before House Oversight Committee in February 2026, stating she never met Epstein; Ghislaine Maxwell played a central role in founding the Clinton Global Initiative.",Hillary Rodham Clinton,0,1568,0,No,American
Hind Alowais,associate,UAE contact from the prominent Alowais family who maintained regular social contact with Epstein from at least 2011 through 2012. Dinner meetings and Skype calls were coordinated through Lesley Groff.,,0,666,0,No,Emirati
Hosain Rahman,business,"Former CEO of Jawbone, a wearable technology company. Named in Epstein documents in connection with financial dealing...",Hos; Hosain,0,6,0,No,Pakistani American
Howard Gardner,academic,Harvard education professor who received Epstein funding and maintained post-conviction contact.,,0,512,0,No,American
Howard Lorber,business,Douglas Elliman CEO; referenced in Epstein's emails and 'war council' proposal.,Lorber,0,40,0,No,American
Hugh Herr,academic,MIT Media Lab bionics professor who met Epstein to discuss One Science initiative.,,0,252,0,No,American
Hugh J. Hurwitz,associate,"Recipient of the email, potentially involved in oversight or management of the Federal Bureau of Prisons.",Hurwitz; Hugh Hurwitz,0,203,0,No,
Hunter Biden,other,Biden's son; on DOJ 305 list entirely via news articles forwarded within Epstein's emails.,H. Biden,0,126,0,No,American
Hyatt Bass,socialite,"American socialite, author, and philanthropist, daughter of Texas billionaire Sid Bass. Listed in Jeffrey Epstein's contact black book. Hyatt Bass moved in overlapping social circles with Epstein and Ghislaine Maxwell through New York and Hamptons elite networks during the 1990s and 2000s. She is the author of the novel The Embers (2007). Her family's connections to Texas oil wealth and New York philanthropy placed her within the broader social world documented in Epstein's records.",,0,483,0,Yes,American
IGGY Mandy,associate,Commenter,,0,114,0,No,
Ian & Tara Maxwell,associate,Ian Maxwell and Tara Maxwell are among the siblings of Ghislaine Maxwell; Ian was listed as a potential defense witness in Ghislaine's 2021 federal trial. Ian also appears in correspondence forwarded by Ghislaine to Epstein regarding a Facebook secondary-market share offering in 2010.,Maxwell,0,1386,0,No,
Ian Maxwell,socialite,Ghislaine Maxwell's brother; public defender of her case.,,0,1536,0,Yes,British
Ian Osborne,business,British fixer who helped rehabilitate Epstein's image; Epstein helped him found Hedosophia. Visited Epstein's island in 2012.,,0,5922,0,No,British
Ike Perlmutter,business,Chairman of Marvel Entertainment; Wolff emailed Epstein in 2016 asking if he knew Perlmutter.,,0,4,0,No,Israeli-American
Ilan Epstein,associate,Inmate listed alongside Jeffrey Epstein in Bureau of Prisons monitoring records at MCC New York.,,0,26955,0,No,
Iman,celebrity,Somali-American supermodel; listed in black book; David Bowie's widow; no allegations.,Iman Mohamed Abdulmajid,0,0,0,Yes,Somali-American
Inmate 3,associate,"Epstein's cellmate who was transferred on August 9, 2019.",,0,408,0,No,
"Inmate Reyes, Efrain",associate,Epstein's cellmate,Efrain; Inmate Efrain,0,61,0,No,
Ira B. Lamster,academic,"Dean of Columbia University College of Dental Medicine and professor of health policy, in direct email contact with Jeffrey Epstein who provided funding to Columbia.",Lamster; Ira Lamster,0,262,0,No,
Irina Chernova,associate,"Krasnoyarsk-born MSU journalism graduate who became an Epstein recruiter, initially through Malysheva, then sending profiles directly by 2009.",,0,0,0,No,Russian
Isabel Maxwell,socialite,Ghislaine Maxwell's sister; tech executive; listed in Epstein black book; ex-husband Al Seckel provided Epstein reputation management services.,,0,1628,0,Yes,British-American
Ivan Rosh,associate,Caller who left a message for Epstein.,,0,13,0,No,
Ivana Trump,socialite,Czech-American businesswoman and first wife of Donald Trump; part of the same 1980s-90s New York social circles as Epstein.,Ivana Marie Zelnickova,0,265,0,Yes,Czech-American
Ivanka Trump,politician,Daughter of Donald Trump; appears in Epstein address book alongside her father and Ivana Trump; photographed with Trump and Epstein in 1993; no wrongdoing alleged.,,0,439,0,No,
J. A. Keller,associate,"Regional Director, Southeast Region.",Keller; J. Keller,0,54,0,No,
J. E.,associate,Recipient of messages.,,0,508,0,No,
J. Ray Ormond,associate,Federal Bureau of Prisons Regional Director for the Northeast who received internal BOP communications following Epstein's death at MCC New York.,"Ormond; J. Ormond; Ormond, Ray",0,512,0,No,
JD Vance,politician,Current VP; on DOJ 305 list; called elite connections 'pretty gross',Vance; James David Vance,0,58,0,No,American
JEANNIE BREANON,associate,Recipient of packages sent by Epstein.,,0,9,0,No,
JENNIFER GAFFNEY,associate,Assistant District Attorney at Jeffrey Epstein's SORA hearing.,,0,45,0,No,
JJ Litchford,business,Deutsche Bank Associate Banker; worked on Epstein accounts alongside Amanda Kirby (2014-2016),Jonathan Kemp Litchford; Jonathan Litchford,0,1693,0,No,American
JOHN M. LEVENTHAL,associate,Co-counsel with Arthur L. Aidala.,LEVENTHAL; JOHN LEVENTHAL; Jack M. LEVENTHAL,0,19,0,No,
JP Morgan (Institutional),business,Maintained 55 Epstein accounts 1998-2013; paid $290M settlement; processed over $1B in transactions.,(Institutional); JP (Institutional),0,2825,0,No,American
Jack Horner,academic,Renowned paleontologist who visited Epstein's Zorro Ranch in 2012.,John Robert Horner; John Horner,0,374,0,No,American
Jack Lang,politician,Former French Minister of Culture whose name appears 673 times in Epstein files; under criminal investigation for money laundering since February 2026.,John Lang,0,1286,0,No,French
Jack P. Hill,associate,Attorney for Plaintiff.,Jack Hill; John P. Hill,0,348,0,No,
Jackie Kalin,associate,University nursing student and sister of Jennifer Kalin who received direct financial support from Epstein.,Jackie Kain; Jackie Kahn,0,61,0,No,
Jacqui Safra,business,Billionaire banker; Safra dynasty; black book entry.,Jacob Eli Safra; J.E. Safra; J.E. Beaucaire; Jackie Safra,0,186,0,Yes,Swiss-Brazilian
James C. Wills,associate,"Former Acting Assistant Director, Reentry Services Division who appointed the team to conduct the psychological recon...",Wills; James Wills; Jim C. Wills,0,107,0,No,
James Ce,associate,NYC-based IT consultant and founder of Personal Genius LLC. Served as Epstein's primary personal technology support p...,james | personal genius; Jim Ce,0,16,0,No,
James Charlick,associate,GAM Investments executive; mentioned in Epstein-related emails.,Jim Charlick,0,4,0,No,
James Christe,associate,Videographer,Jim Christe,0,14,0,No,
James Comey,legal,Former FBI Director; daughter prosecuted Maxwell case; mentioned in news clippings.,Comey; Jim Comey,0,23,0,No,American
James Goldston,other,Journalist listed in Epstein's black book.,Jim Goldston,0,1,0,Yes,British
James L. Brochin,associate,Counsel for Defendant Jeffrey Epstein.,Brochin; James Brochin; Jim L. Brochin,0,12,0,No,
James Palumbo,politician,Ministry of Sound founder; Baron Palumbo; mentioned in Mandelson-Epstein email.,Lord Palumbo; Jim Palumbo,0,71,0,No,British
James Peterson,associate,Owner of Peterson Properties Real Estate Services Inc.,Jim Peterson,0,53,0,No,
James Petrucci,associate,Recipient of the email.,Jim Petrucci,0,154,0,No,
James Stunt,socialite,Businessman listed in Epstein's black book.,Jim Stunt,0,108,0,Yes,British
James Tisch,business,CEO of Loews Corporation; listed in Epstein's black book; father of NYPD Commissioner Jessica Tisch.,Jimmy Tisch; Merryl & Jimmy Tisch; Jim Tisch,0,294,0,Yes,American
Jamie Dimon,business,JPMorgan CEO deposed in Epstein-related lawsuit.,James Dimon,0,303,0,No,American
Jamie Foxx,celebrity,Actor and musician (Ray); named in an unverified FBI tip in Epstein files; no investigation or charges.,,0,31,0,No,
Jamie Raskin,politician,House Judiciary ranking member; addressee of DOJ 305 letter; transparency advocate.,Raskin,0,3,0,No,American
Jane,other,Maxwell trial witness (pseudonym); abused from age 14.,Maxwell Trial Pseudonym,0,0,0,No,American
Jane Doe #1,associate,Petitioner,Jane #1,0,2133,0,No,
Jane Doe #2,associate,Petitioner,Jane #2,0,2172,0,No,
Jane Doe No. #3,associate,Proposed additional petitioner.,Jane #3,0,451,0,No,
Jane Doe No. 4,associate,Proposed additional petitioner.,Jane 4,0,393,0,No,
Jane Does,associate,Victim who filed an emergency petition alleging CVRA violations.,,0,18953,0,No,
Janet Reno,legal,First female AG; served during early Epstein period; former Miami-Dade State Attorney.,Reno,0,127,0,No,American
Janice Dickinson,celebrity,Supermodel and TV personality; 2 phone numbers in Epstein's black book; no allegations of wrongdoing.,Janice Doreen Dickinson,0,31,0,Yes,American
Janis Hartley,politician,Bill Richardson's deputy chief of staff; linked to Epstein clemency attempts.,,0,52,0,No,American
Janusz Banasiak,associate,Epstein's Polish-born Palm Beach house manager and chauffeur for over a decade; testified in depositions about massage payments; Epstein paid his legal fees.,,0,5956,0,Yes,Polish-American
Jared Kushner,politician,Trump's son-in-law; 2013 Observer invitation to Epstein; referenced in Ambani-Epstein messages.,Kushner,0,176,0,No,American
Jason Calacanis,business,Tech investor who connected Epstein to Bitcoin developers in 2011.,,0,73,0,No,American
Jay Clayton,associate,United States Attorney for the Southern District of New York.,,0,130,0,No,
Jay Lefkowitz,legal,Kirkland and Ellis attorney; key Epstein defense counsel during the 2007-2008 non-prosecution agreement negotiations; former Bush administration envoy.,,0,1237,0,No,American
Jay-Z,celebrity,Hip-hop mogul; on DOJ 305 list; named in 2019 anonymous FBI tip citing a circa-1996 incident; tip not corroborated; no charges or formal investigation.,Shawn Carter; Jay Z; JAY-Z,0,0,0,No,American
Jean Doumanian,business,TV/film producer; former SNL producer; black book entry.,,0,70,0,Yes,American
Jean Huguen,associate,"Paris interior designer hired for Epstein's Avenue Foch apartment; appears in 1,215 documents but has received no mainstream media coverage.",,0,1215,0,No,French
Jean Luc Bernard,associate,potential deponent,Bernard; Jean Bernard,0,164,0,No,
Jean Pierre Bourgeois,other,French contact listed in Epstein's black book.,Bourgeois; Jean Bourgeois,0,1,0,Yes,French
Jean-Georges Vongerichten,other,Celebrity chef listed in Epstein's black book.,,0,4,0,Yes,French-American
Jean-Jacques Galtier,other,French dentist listed in Epstein's black book.,,0,0,0,Yes,French
Jean-Marie Le Pen,politician,French far-right politician; 2 black book numbers; daughter Marine cited 88 times in EFTA files; died 2025.,Jean-Marie Pen,0,3,0,Yes,French
Jeanne Brennan Wiebracht,politician,USVI CPA and de Jongh campaign accountant; Epstein paid her children's tuition; listed on Epstein island microwave license; named in Epstein's will for $1M.,Wiebracht; Jeanne Wiebracht,0,552,0,No,
Jeff Bezos,business,Amazon founder in Epstein's black book; named in 2009 Maxwell email and 2011 Edge dinner list; no allegations of wrongdoing.,Jeffrey Preston Bezos; Jeffrey Bezos,0,276,0,Yes,American
Jeff Holman,associate,Person who made a phone call.,Jeffrey Holman,0,44,0,No,
Jeff Koons,other,"American contemporary artist known for large-scale sculpture and appropriation art, including the Balloon Dog series and works sold for record prices at auction. Listed in Jeffrey Epstein's contact black book. Koons attended social events in circles that overlapped with Epstein's network in New York and internationally during the 1990s and 2000s. His custody dispute involving ex-wife Ilona Staller was widely covered during the period of his association with Epstein's social circle.",Jeffrey Koons,0,555,0,Yes,American
Jeff Sessions,politician,Former AG 2017-2018; subpoenaed by House Oversight in 2025 over DOJ handling of Epstein case during his tenure; on DOJ 305-person list.,Sessions; Jefferson Sessions; Jeffrey Sessions,0,344,0,No,American
Jeff Zucker,business,Former CNN president; wife photographed with Maxwell; often confused with Zuckerman.,Zucker; Jeffrey Zucker,0,30,0,No,American
Jeffery A. Martin,academic,"Academic researcher, author.",Martin; Jeffery Martin,0,65,0,No,
Jeffery Pagliuca,associate,Attorney representing Ghislaine Maxwell.,,0,16,0,No,
Jeffrey Fuller,associate,MC2 business associate connected to Epstein funding.,Jeff Fuller,0,310,0,No,American
Jeffrey H. Sloman,legal,First Assistant U.S. Attorney (SDFL) who supervised the Epstein plea deal. Now at Stumphauzer Kolaya Nadler & Sloman.,Jeff Sloman; Mr. Sloman; Mr Sloman; Sloman; Jeffrey Sloman; Jeff H. Sloman,0,762,0,No,
Jeffrey Jones,business,Business contact listed in Epstein's black book.,Jeff Jones,0,6,0,Yes,American
Jeffrey M. Herman,associate,Miami attorney and co-founder of Herman and Mermelstein PA who represented multiple Epstein victims in civil litigation from 2008 onward.,Herman; Jeffrey Herman; Jeff M. Herman,0,405,0,No,
Jeffrey Oestericher,associate,Assistant United States Attorney.,Jeff Oestericher,0,3,0,No,
Jeffrey Sachs,academic,"American economist and Columbia University professor known for his work on sustainable development, poverty reduction, and macroeconomic policy. Director of the Earth Institute at Columbia and later the Center for Sustainable Development. Sachs received funding from Jeffrey Epstein for economic research initiatives and appeared on Epstein's donor lists, a relationship that drew scrutiny after Epstein's 2019 arrest. Sachs acknowledged the funding and expressed regret over the association.",Jeff Sachs,0,463,0,No,American
"Jeffrey, J.",associate,"person whose relationship with the speaker is being kept secret, and someone who needs help with work.",,0,161,0,No,
Jena Masquelier,associate,Individual who communicated with Epstein associates via email. Appears in 261 documents across multiple EFTA datasets.,,0,286,0,No,
Jenna Mulhall-Brereton,other,Introduced by Epstein to Nina K.; Gates Foundation correspondence.,Jenna Mulhall; Jenna Brereton,0,23,0,No,
Jennie Saunders,associate,"Individual whose name appears in telephone message logs recovered from Epstein offices, showing calls placed to Epstein staff. The logs record attempts to reach Epstein, consistent with the volume of incoming correspondence documented across the case files.",,0,2223,0,No,
Jennifer Jacquet,academic,Academic with 200+ file mentions; sought Epstein funding 2011-2012; connected via John Brockman.,JJ,0,364,0,No,American
Jennifer Turner,associate,Name on AMEX sub-accounts paired with Ghislaine Maxwell (2010-2017). Investigated by FBI as possible Maxwell alias.,,0,13,0,No,
Jens Stoltenberg,politician,Former NATO chief; 7+ file mentions related to NATO funding discussions.,Stoltenberg,0,0,0,No,Norwegian
Jenson Smith,associate,Paralegal on the case.,,0,8,0,No,
Jeremy Cheung,other,In photograph found in email.,,0,219,0,No,
Jeremy Rubin,academic,MIT Bitcoin Club co-founder who pitched Epstein on crypto investments.,,0,1089,0,No,American
Jerry Perenchio,business,President of Univision.,,0,5,0,No,
Jessica de Rothschild,socialite,"British socialite and actress, daughter of Evelyn de Rothschild and his first wife Jeanette Bishop. Listed in Jeffrey Epstein's contact black book. She moved in elite British and international social circles that overlapped with Ghislaine Maxwell's network. Her family's banking dynasty and connections to British aristocracy placed her within the broader social world documented in Epstein's address records.",Rothschild; Jessica Rothschild,0,354,0,Yes,British
Jibby 2j,associate,Sender of a message on Myspace.,,0,2,0,No,
Jide Zeitlin,business,"Nigerian-born American businessman who served as a partner at Goldman Sachs before becoming CEO of Tapestry, the luxury fashion group that owns Coach, Kate Spade, and Stuart Weitzman. Zeitlin resigned as Tapestry CEO in July 2020 after admitting to providing false information in response to a misconduct allegation. Named in Jeffrey Epstein email correspondence discussing business and social arrangements. His name appears in documents filed in civil proceedings related to the Epstein case.",,0,271,0,No,
Jill Biden,politician,Former First Lady; on DOJ 305 list via incidental news clippings.,Dr. Jill Biden,0,20,0,No,American
Jim Coleman,other,Audio Video Salon owner; provided AV equipment for Epstein properties.,James Coleman,0,322,0,No,American
Jimmy Buffett,celebrity,Singer-songwriter (Margaritaville); black book listing with Palm Beach address; appeared in Epstein photo with Clinton and Maxwell; on 1995 fundraiser guest list; died 2023; no allegations.,,0,45,0,Yes,American
Joan Rivers,celebrity,Comedian and TV host; listed in Epstein's black book (p. 46); deceased 2014.,Joan Alexandra Molinsky,0,67,0,Yes,American
Joanna Rubinstein,other,Swedish UNHCR chair who visited Epstein's island in 2012; resigned Feb 2026.,,0,112,0,No,Swedish
Joe Biden,politician,46th President; appears in 503 Epstein documents in indirect contexts; mentioned in Poetry in America funding emails and Cancer Moonshot correspondence; on DOJ 305-name list with no direct connection reported.,Biden; Joseph Biden,0,503,0,No,American
Joey Hunter,associate,,,0,428,0,Yes,
Johanna Sjoberg,other,Epstein accuser who provided deposition about New York mansion.,,0,55,0,No,American
Johanna Thuringer,associate,Swedish model who received Epstein wire transfers and evening appointments; KJK demand denied.,Johanna Maria Margareta Thuringer,0,154,0,No,Swedish
John 'Jack' Kessler,business,Co-founder of New Albany Company with Wexner; Epstein made general partner; black book entry.,John Kessler; Jack Kessler; Kessler; Jack 'Jack' Kessler,0,238,0,No,American
John Barrow,associate,Caller,Jack Barrow,0,47,0,No,
John Bolton,politician,Former NSA; mentioned in third-party discussions within Epstein's files.,Bolton; Jack Bolton,0,75,0,No,American
John Brennan,military-intelligence,Former CIA Director (2013-2017); named on DOJ 305 list of politically exposed persons in Epstein files; no documented direct contact with Epstein identified in public reporting.,Brennan; Jack Brennan,0,1623,0,No,American
John Cacioppo,academic,Social neuroscience pioneer; consulted by Epstein associate; died 2018.,Jack Cacioppo,0,94,0,No,American
John Catsimatidis,business,Billionaire businessman listed in Epstein's black book.,Jack Catsimatidis,0,124,0,Yes,American
John Cleese,celebrity,Monty Python comedian; 2 black book entries (page 11); 7 docs in released files; no allegations.,Jack Cleese,0,7,0,Yes,British
John Csakany,associate,Chief Deputy U.S. Marshal.,Jack Csakany,0,8,0,No,
John Duffy,business,Former JPMorgan banker named in Epstein lawsuits.,Jack Duffy,0,251,0,No,American
John Heah,business,"Luxury hospitality architect (Aman Resorts, Four Seasons) who received Epstein island design commission (2018)",Jack Heah,0,178,0,No,British
John Kerry,politician,"Former U.S. Secretary of State and Senator from Massachusetts; listed in Epstein black book with 7 phone numbers; received $4,000 in campaign donations from Epstein; named on DOJ 305 list.",John Forbes Kerry; Jack Kerry,0,574,0,Yes,American
John M O'Quinn,associate,Attorney,O'Quinn; John O'Quinn; Jack M O'Quinn,0,4,0,No,
John M. Eaves,associate,Attorney and donor,Eaves; John Eaves; Jack M. Eaves,0,79,0,No,
John Markoff,other,NYT tech journalist; on Dan Dubno's list of experts shared with Epstein.,Jack Markoff,0,109,0,No,American
John Paulson,business,Billionaire hedge fund manager; listed in Epstein's black book; documents show largely unreturned outreach from Epstein.,John Alfred Paulson; Jack Paulson,0,130,0,Yes,American
John Phelan,politician,U.S. Navy Secretary who flew on Epstein's Boeing 727 in 2006.,Jack Phelan,0,31,0,No,American
John Podesta,associate,Former White House Chief of Staff.,Jack Podesta,0,36,0,No,
John Ratcliffe,military-intelligence,Current CIA Director; on DOJ 305 list; subject of congressional demand to disclose CIA Epstein records after agency refused to confirm or deny their existence.,Ratcliffe; Jack Ratcliffe,0,84,0,No,American
John Turner,associate,Oil and gas/real estate professional making a donation.,Jack Turner,0,139,0,No,
John de Jongh,politician,Former USVI Governor 2007-2015; Epstein paid $70K in his children's college tuition; wife Cecile worked as Epstein's personal assistant.,Jongh; John Jongh; Jack de Jongh,0,745,0,No,American
Johnny El Hachem,business,CEO of Edmond de Rothschild Private Equity who discussed infrastructure fund opportunities with Epstein.,Johnny El Hachem Po; Hachem; Johnny Hachem,0,92,0,No,Lebanese-French
"Johnson, C.J.",associate,Chief Judge,,0,34,0,No,
Jonathan Farkas,other,New York real estate developer. Emailed Epstein about speaking with Donald Trump and Melania Trump in April 2019. Wif...,Jon Farkas,0,1241,0,No,American
Jonathan Fascitelli,business,Real estate executive; proposed $80M+ deals through Epstein via Cayman Islands vehicles.,,0,5,0,No,American
Jools Holland,celebrity,British pianist and BBC host (Later... with Jools Holland); listed in Epstein's black book.,Julian Miles Holland,0,58,0,Yes,British
Joscha Bach,academic,AI researcher; Epstein funded his life 2013-2019 ($300K+ in donations plus personal expenses),Joscha Christoph Bach,0,1005,0,No,German-American
Joseph Pecorino,associate,District Executive's Office.,Joe Pecorino,0,28,0,No,
