Name,Category,Bio,Aliases,Flights,Documents,Connections,In Black Book,Nationality
Mehmet Beskardes,legal,Turkish lawyer; represented Epstein in international legal matters.,,0,46,0,No,American
Mel Slater,academic,Computer scientist and virtual reality researcher at UCL and University of Barcelona.,,0,40,0,No,British
Melania Trump,politician,"First Lady; October 2002 email to Ghislaine Maxwell in DOJ files shows prior social acquaintance; Epstein assistant claimed Epstein introduced her to Trump, disputed by White House.",,0,290,0,No,
Melanie Spinella,staff,Executive assistant to Leon D. Black at Apollo Management. Primary administrative liaison between Black and Jeffrey E...,,0,580,0,No,American
Melissa Dalton,associate,"JPMorgan Private Bank representative assigned to accounts held by Jeffrey Epstein and Ghislaine Maxwell, listed alongside Francisco Villacis on banking statements entered as government exhibits.",,0,334,0,No,
Melissa Desori,associate,Associate attorney on the Parse matter.,,0,3,0,No,
Melissa Madrigal,associate,Co-counsel for Defendant Ghislaine Maxwell.,,0,11,0,No,
Merrick Garland,legal,Former AG; oversaw Maxwell prosecution; initially resisted full file release.,Garland,0,13,0,No,American
Merwin de la Cruz,associate,House manager at Epstein's Manhattan townhouse; identified in Maxwell trial evidence; Epstein funded his travel to the Philippines.,Merwin Cruz; Merwin Dela Cruz,0,14684,0,No,
Michael Baden,associate,Forensic pathologist mentioned in the article.,Mike Baden,0,60,0,No,
Michael Carroll,associate,Recipient of the email.,Mike Carroll,0,56,0,No,
Michael Carvajal,associate,Recipient of the email.,Mike Carvajal,0,32,0,No,
Michael Cherry,associate,Contact listed in Epstein's black book.,Mike Cherry,0,64,0,Yes,American
Michael Cohen,legal,Trump's ex-lawyer; offered Trump-Epstein info in Rule 35 motion; SDNY declined.,Cohen; Mike Cohen,0,380,0,No,American
Michael Colhoun,associate,Contact listed in Epstein's black book.,Mike Colhoun,0,5,0,Yes,British
Michael Dell,business,"American billionaire entrepreneur and founder of Dell Technologies, one of the world's largest technology companies. Listed in Jeffrey Epstein's contact black book and appeared in documents associated with Epstein's social and business network. Dell is among numerous prominent business figures whose contact information was recorded in Epstein's address records, reflecting the breadth of Epstein's self-cultivated relationships in the global technology and finance elite.",Mike Dell,0,261,0,Yes,American
Michael Douglas,celebrity,"Actor (Wall Street, Fatal Attraction); mentioned in 3 emails by Peggy Siegal and Michael Wolff; no direct Epstein contact, black book, or flight appearances.",Mike Douglas,0,382,0,No,American
Michael Fifer,associate,Contact listed in Epstein's black book.,Mike Fifer,0,14,0,Yes,American
Michael Flynn,military-intelligence,Former National Security Advisor; on DOJ 305-name list; no documented direct Epstein contact; publicly demanded greater accountability from Trump administration after file release.,Flynn; Mike Flynn,0,239,0,No,American
Michael Genovese,legal,Attorney listed in Epstein's black book.,Mike Genovese,0,1,0,Yes,American
Michael Greco,associate,U.S. Marshal,Mike Greco,0,65,0,No,
Michael Hammer,associate,Recipient of letters and faxes.,Mike Hammer,0,154,0,No,
Michael J. Fitzpatrick,associate,Chief U.S. Probation Officer.,Fitzpatrick; Michael Fitzpatrick; Mike J. Fitzpatrick,0,38,0,No,
Michael Jackson,celebrity,"American musician and entertainer known as the 'King of Pop.' Listed in Epstein's black book with 3 phone numbers. An FBI FD-302 witness statement records a visitor to Epstein's residence speaking to Jackson by telephone. A photograph of Jackson with Epstein was included in the December 2025 DOJ release under the Epstein Files Transparency Act; his former bodyguard said the photo was taken during a brief Palm Beach house-hunting visit around 2002-2003. Jackson died on June 25, 2009. No accuser testimony places him at Epstein's properties or links him to criminal conduct.",King of Pop; Mike Jackson,0,580,0,Yes,American
Michael Kennedy,legal,Attorney listed in Epstein's black book.,Mike Kennedy,0,120,0,Yes,American
Michael Milken,business,Junk Bond King; on Epstein's seminar list; Drexel Burnham Lambert orbit overlap.,Milken; Mike Milken,0,22,0,No,American
Michael Reiter,legal,"Former Palm Beach Police Chief who investigated Epstein in 2005-2006, identified 30+ victims, and directly referred the case to the FBI after concerns about state prosecution.",Mike Reiter,0,695,0,No,American
Michael Salnick,associate,Attorney representing Janusz Banasiak.,Mike Salnick,0,38,0,No,
Michael Saylor,business,MicroStrategy founder mentioned in Epstein-related charity event email.,Mike Saylor,0,23,0,No,American
Michael Steinhardt,business,Hedge fund manager listed in Epstein's black book.,Mike Steinhardt,0,11,0,Yes,American
Michael Stroll,business,Business contact listed in Epstein's black book.,Mike Stroll,0,112,0,Yes,American
Michael Toporek,associate,Sender of letters to David Parse.,Mike Toporek,0,2,0,No,
Michael Wolff,other,"Journalist and author of ""Fire and Fury""; used Epstein as a source on Trump; recorded roughly 100 hours of interviews with Epstein over several years.",Mike Wolff,0,6030,0,Yes,American
Michel Hazanavicius,celebrity,"Oscar-winning French director; emailed Epstein March 2012 to Jan 2014; attended Paris dinners with Epstein and Woody Allen; asked to procure a girl, replied it was his wife; cut contact thereafter.",,0,409,0,No,French
Michelle Fern Saipher,other,Mentioned in Epstein's will.,Saipher; Michelle Saipher,0,100,0,No,
Michelle Healey,associate,Defense witness,,0,12,0,No,
Mick Jagger,celebrity,Rolling Stones frontman; 4 black book numbers; recipient of a 2003 FedEx shipment sent via Epstein's account and Ghislaine Maxwell; photographed with Epstein and Clinton.,Sir Michael Philip Jagger,0,140,0,Yes,British
Mike Edmondson,associate,State attorney's spokesman.,Michael Edmondson,0,92,0,No,
Mike Hardman,business,"Financial associate mentioned in Epstein documents in connection with $200,000 transactions.",Michael Hardman,0,82,0,No,
Mike Huckabee,politician,US Ambassador to Israel; on DOJ 305 list; daughter's White House statements also in files.,Huckabee; Michael Huckabee,0,38,0,No,American
Mike Pence,politician,Former VP; on DOJ 305 list; called for full transparency in 2025.,Pence; Michael Pence,0,242,0,No,American
Mike Pompeo,politician,Former Secretary of State; mentioned in third-party discussions within Epstein's files.,Pompeo; Michael Pompeo,0,3,0,No,American
Mike Wallace,celebrity,"60 Minutes journalist; 2 black book numbers; accuser ""Jane"" testified she sang at his 80th birthday with Epstein and Maxwell present; died 2012.",Myron Leon Wallace; Michael Wallace,0,238,0,Yes,American
Mikhail Prokhorov,business,Russian billionaire and former Brooklyn Nets owner who appeared at the same parties as Epstein and sought introductions to Warren Buffett through him.,Prokhorov; Onexim,0,52,0,No,Russian
Miles Taylor,associate,Contact listed in Epstein's black book.,,0,7,0,Yes,American
Minnie Driver,celebrity,"British actress (Good Will Hunting); listed page 15 of Epstein's black book with work number only; no emails, flights, or allegations.",Amelia Fiona Jessica Driver,0,867,0,Yes,British-American
Minor Victim 4,associate,"Alleged victim, an eleven-year-old girl.",Minor 4,0,1946,0,No,
Minor Victim-5,associate,"Alleged victim, an 8-year-old girl.",,0,13,0,No,
Minor Victim-6,associate,"Alleged victim, another minor under 14 years old.",,0,12,0,No,
Minor Victim-7,associate,14-year-old victim of alleged sex trafficking.,,0,5,0,No,
Mira Nair,celebrity,Filmmaker (Monsoon Wedding); attended afterparty at Maxwell's townhouse in 2009 per Epstein email.,,0,136,0,No,Indian-American
Miroslav Lajcak,politician,Slovak diplomat who resigned as PM Fico's security adviser after Epstein files revealed messages about 'beautiful girls' and offers to connect Bannon with Fico.,Miroslav Lajčák,0,392,0,No,Slovak
Misha Gramanov,other,Mentioned in Epstein's will.,,0,5,0,No,
Mitchell Webber,legal,"Lawyer, partner at Paul, Wess.",,0,8,0,No,
Mitt Romney,politician,Former Senator/Governor; on DOJ 305 list via news articles in Epstein's files.,Romney,0,397,0,No,American
Mohamed Hadid,business,Real estate developer listed in Epstein's black book.,,0,0,0,Yes,Palestinian-American
Mohammed bin Salman,royalty,Crown Prince of Saudi Arabia.,MBS; Mohammed bin Salman Al Saud; Salman; Mohammed Salman,0,156,0,No,Saudi
Moira Penza,associate,Former federal prosecutor and legal expert.,,0,2,0,No,
Mona Juul,politician,Norwegian ambassador to Jordan; resigned over Epstein ties after DOJ release.,,0,75,0,No,Norwegian
Monica Lewinsky,other,Anti-bullying advocate; mentioned in Epstein files in context of Clinton scandal history.,Lewinsky,0,115,0,No,American
Mort Janklow,other,Literary agent listed in Epstein's black book.,Morton Lloyd Janklow,0,2,0,Yes,American
Mr. Benhamou,associate,person who provided Westlaw report to Ms. Trzaskoma.,,0,4,0,No,
Mr. Berke,associate,person informed by Ms. Trzaskoma.,,0,35,0,No,
Mr. Berry,associate,defendant,,0,625,0,No,
Mr. Daugerdas,associate,defendant represented by Mr. Gair.,,0,13,0,No,
Mr. DeMARCO,associate,attorney,,0,43,0,No,
Mr. Glassman,associate,attorney for Plaintiff.,,0,1571,0,No,
Mr. HOBSON,associate,attorney,,0,743,0,No,
Mr. Hernandez,associate,Prosecutor/Attorney,,0,1104,0,No,
Mr. Jack Goldberger,associate,Epstein's defense attorney.,Goldberger; Mr. Goldberger; Jack Goldberger; John Goldberger; Jack A. Goldberger; John A. Goldberger,0,3797,0,No,
Mr. John Wallace,associate,"Staff Attorney, MDC Brooklyn.",Wallace; Mr. Wallace,0,236,0,No,
Mr. Jones,associate,Victim,,0,4086,0,No,
Mr. Jules Burney,associate,expert on French law cited in the document.,Burney; Mr. Burney,0,6,0,No,
Mr. Leopold,associate,attorney for the witness.,,0,640,0,No,
Mr. Madelson,associate,Person who telephoned.,,0,14,0,No,
Mr. Nardello,associate,private investigator hired by Kramer Levin and the witness's team.,,0,45,0,No,
Mr. Pagliucca,associate,Attorney representing G Maxwell.,,0,12,0,No,
Mr. Parse,associate,individual involved in tax transactions.,,0,258,0,No,
Mr. Perry,associate,Subject of an addendum opinion from the U.K.,,0,2872,0,No,
Mr. Robertson,associate,defendant,,0,887,0,No,
Mr. Rotert,associate,Witness or attorney,,0,18,0,No,
Mr. Schoeman,associate,witness being deposed.,,0,223,0,No,
Mr. Tein,associate,Examining attorney,,0,4648,0,No,
Mr. Vega,associate,witness,,0,1711,0,No,
Ms. Conrad,associate,Witness/Juror being questioned.,,0,767,0,No,
Ms. Edelstein,associate,witness,,0,87,0,No,
Ms. Maxwell's husband,associate,Co-signer of the personal recognizance bond.,husband; Ms. husband,0,148,0,No,
Ms. Sophia Papapetru,associate,"Staff Attorney at MDC Brooklyn, Federal Bureau of Prisons.",Papapetru; Ms. Papapetru,0,21,0,No,
Ms. Sterntheim,associate,Witness who testified.,,0,9,0,No,
Ms. Trizaskoma,associate,team member involved in discussions about the juror.,,0,43,0,No,
Murray Gell-Mann,academic,"Nobel physicist; longtime Epstein friend, black book, island visitor.",Murray Gell; Murray Mann,0,149,0,Yes,American
Myla Trestiza,associate,Yacht stewardess (M/Y Te Manu); documents found in Little St. James FBI raid.,Myla Lacson Trestiza,0,1628,0,No,Filipino
N'Diaye Skipper-Scott,associate,Warden of the Metropolitan Correctional Center.,N'Diaye Skipper; N'Diaye Scott,0,31,0,No,
"N'Diaye, Warden",associate,Institution's Warden,,0,104,0,No,
NER Regional Director,associate,"Arrived at the institution on August 15, 2019.",Director; NER Director,0,10004,0,No,
Nacho Figueras,celebrity,Argentine polo player; name appears in an Epstein social contact list for a William Astor dinner (2010); no allegations.,Ignacio Figueras,0,1,0,Yes,Argentine
Nancy Ayers,associate,"Chief, Office of Public Affairs, Federal Bureau of Prisons.",,0,32,0,No,
Nancy Ma,associate,Paralegal on the case.,,0,46,0,No,
Nancy Mace,politician,SC Congresswoman; led discharge petition for Epstein Files Transparency Act; subpoenaed AG Bondi for withheld files; appeared on DOJ 305-person list.,Mace,0,603,0,No,American
Nancy Pelosi,politician,Speaker Emerita; co-sponsored Epstein transparency bill; on DOJ 305 list.,Pelosi,0,127,0,No,American
Nat Rothschild,business,British-Canadian financier and former Atticus Capital co-chair listed in Epstein's address book; referenced in DOJ Mandelson correspondence.,Nathaniel Philip Rothschild,0,361,0,Yes,British
Natalia Domracheva,associate,Ukrainian prima ballerina (Kiev National Opera). Emailed Epstein her Skype; travel paid by Epstein's agency.,Natalia Domratcheva; Natalya Domracheva,0,1,0,No,Ukrainian
Natalia Molotkova,associate,American Express Centurion concierge; booked Epstein's travel including flights for women from Eastern Europe.,Natasha Molotkova; Natalia (Natasha) Molotkova,0,550,0,No,Russian
Natalie Bennett,associate,Author,,0,61,0,No,
Natalya Malysheva,associate,"Russian masseuse in the U.S. who sent Epstein profiles of progressively younger women from late 2005, receiving payment for referrals.",,0,0,0,No,Russian
Nathan Myhrvold,business,Former Microsoft CTO; black book (12 phones) and flight logs.,Nathan Paul Myhrvold,0,2713,0,Yes,American
Nathan Siegel,associate,Attorney for ABC News and NBC News.,,0,37,0,No,
Nathan Wolfe,academic,Stanford virologist who proposed Epstein fund sexual behavior study.,Nathan Daniel Wolfe,0,894,0,No,American
Neal Kassell,academic,UVA neurosurgery professor and Focused Ultrasound Foundation founder/chairman. Met Epstein at 71st St residence Sept ...,,0,87,0,No,American
Nelson Shanks,other,Portrait painter listed in Epstein's black book; deceased.,,0,26,0,Yes,American
Neri Oxman,academic,"American-Israeli designer, architect, and academic who founded the Mediated Matter research group at the MIT Media Lab, where she was a professor until 2019. Known for pioneering work combining design, biology, and digital fabrication. Wife of investor Bill Ackman. Oxman received funding from Jeffrey Epstein for her MIT research, a fact disclosed after Epstein's 2019 arrest prompted MIT to conduct a review of Epstein-linked donations to the university.",,0,258,0,No,
Nicholas Christakis,academic,Yale sociologist who met Epstein in 2013 and corresponded through 2016.,Nicholas Alexander Christakis; Nick Christakis,0,227,0,No,American
Nicholas Cutaia,associate,Person sending an email with a revised draft jury charge.,Nick Cutaia,0,4,0,No,
Nicholas Gruenberg,business,Business contact listed in Epstein's black book.,Nick Gruenberg,0,0,0,Yes,American
Nicholas Haigh,other,Epstein travel entourage member; photographer on trips.,Nick Haigh,0,164,0,No,
Nicholas Negroponte,academic,MIT Media Lab co-founder who recommended accepting Epstein donations.,Nick Negroponte,0,223,0,No,American
Nicholas Ribis,business,Trump casino CEO 1990s; Epstein introduced him to JPMorgan as banking client; planned meetings 2011-2017.,Nick Ribis,0,2021,0,No,
Nicholas Tartaglione,other,Epstein's MCC cellmate during July 2019 neck injury incident; convicted murderer.,Nick Tartaglione,0,136,0,No,American
Nick Lambros,business,Audio equipment vendor; named as defendant in U.S. Virgin Islands lawsuit related to Epstein.,Nicholas Lambros,0,598,0,No,American
Nick Pritzker,business,Hyatt heir; billionaire; emailed Epstein; cousin of Tom Pritzker.,Nicholas Pritzker,0,303,0,No,American
Nicola Caputo,other,Named on FBI co-conspirator list; unredacted by Congress (Feb 2026); identity disputed.,,0,16,0,No,
Nicolas Berggruen,business,Investor listed in Epstein's black book.,,0,77,0,Yes,German-American
Nicole Hesse,associate,Shipper,,0,17,0,No,
Nicole Miller,legal,Legal assistant at Kellerhals Ferguson; scheduled Epstein meetings.,,0,85,0,No,
Nicole Simmons,associate,Person who served the declaration.,,0,204,0,No,
Nikki Haley,politician,Former UN Ambassador; on DOJ 305 list; victim of AI-fabricated Epstein misinformation.,Haley; Nimrata Haley,0,18,0,No,American
Nili Priell,associate,"Key associate of Ehud Barak who appears in 3,474 documents and coordinated communications between Barak and Epstein.",Nili Priell Barak; Nili Priel,0,3508,0,No,Israeli
Noel Allx,associate,Correctional Officer who worked with Thomas and also failed to conduct rounds.,,0,9,0,No,
Nolan H. Brunson,associate,President/Donor,Brunson; Nolan Brunson,0,4,0,No,
Norman K. Moon,associate,Senior federal judge; ruled on Epstein-related CVRA litigation.,Norman Moon,0,712,0,No,
Not specified,associate,The individual whose watch log or duty log this is.,,0,5568,0,No,
Odis Echols,associate,Albuquerque President.,,0,3,0,No,
Oleg Deripaska,business,Russian aluminum oligarch sanctioned by the U.S. in 2018; Epstein provided advice on Deripaska matters through intermediaries including Peter Mandelson.,Deripaska; Oleg Vladimirovich Deripaska,0,54,0,No,Russian
Olga Kurylenko,celebrity,Ukrainian-French actress (James Bond); appears in 3 DOJ docs including a BAFTA event guest list; no allegations.,,0,3,0,Yes,Ukrainian-French
Oliver Sacks,academic,Neurologist and bestselling author; attended Epstein's science dinner parties (deceased),Oliver Wolf Sacks,0,118,0,Yes,British-American
Olivier Colom,politician,"Former Sarkozy diplomatic adviser and Rothschild banker who exchanged 2,000+ emails with Epstein, brokering political introductions.",,0,448,0,No,French
Olivier Laude,associate,"Partner at Laude Esquior Champey, acting on behalf of Cohen & Gresser LLP.",,0,74,0,No,
Onel Pierressaint,associate,Landscaper,,0,23,0,No,
Orly Paris,associate,Paris-based financial contact in Epstein's Deutsche Bank correspondence.,,0,998,0,No,
Orville D. McDonald,associate,Investor and donor,McDonald; Orville McDonald,0,83,0,No,
Oscar S. Wyatt Jr.,associate,Business owner/Donor,Oscar Jr.; Oscar S. Wyatt,0,5,0,No,
Oscar de la Renta,business,Fashion designer listed in Epstein's black book; deceased.,Renta; Oscar Renta,0,65,0,Yes,Dominican-American
PIMP JUICE,associate,Myspace profile owner.,,0,63,0,No,
Pamela J. Bondi,associate,United States Attorney General.,Bondi; Pamela Bondi,0,57,0,No,
Paolo Zampolli,associate,Model agent who co-attempted Elite Models acquisition with Epstein; partnered with Maxwell on TerraMar.,,0,11,0,No,Italian
Pat Benatar,celebrity,Rock and Roll Hall of Fame inductee (2022); four consecutive Grammy wins (1980-1983); listed in Epstein's black book.,Patricia Mae Andrzejewski; Patricia Benatar,0,7,0,Yes,American
Patricia Neville,other,Model with Wilhelmina Models NYC who had direct email contact with Epstein in 2010.,Pat Neville,0,113,0,No,American
Patrick Byrne,business,Former Overstock.com CEO; Epstein introduced him to Steve Bannon 2018-2019.,Byrne,0,81,0,No,American
Patrick J. Smith,associate,"Partner at Smith Villazor LLP who represented Jordana Feldman, the independent administrator of the Epstein Victims Compensation Program, in the Maxwell federal proceedings.",Smith; Patrick Smith,0,266,0,No,
Patrick Ochin,associate,"Confirmed on multiple Paris flights with Epstein, Maxwell, and Brunel between 2003 and 2004.",,0,43,0,No,French
Paul A. Engel Mayer,associate,United States District Judge.,Mayer; Paul Mayer,0,101,0,No,
Paul Allen,business,Microsoft co-founder; 3 black book numbers; died 2018; no allegations.,,0,887,0,Yes,American
Paul Barrett,business,"Epstein's personal trader and asset manager; founded Alpha Group Capital, had power of attorney over Epstein's accounts.","Barrett, Paul S; Paul S. Barrett",0,2292,0,No,American
Paul Blanchard,associate,Business owner and donor.,,0,58,0,No,
Paul Cassell,legal,Former federal judge and law professor; represented Epstein's victims in landmark CVRA lawsuit.,,0,905,0,No,
Paul E. Cook,associate,Program manager,Paul Cook,0,234,0,No,
"Paul H. Schoeman, Esq.",associate,attorney mentioned in conversation.,"Paul Esq.; Paul H. Schoeman,",0,180,0,No,
Paul Harris,associate,Contact listed in Epstein's black book.,,0,134,0,Yes,British
Paul Kedrosky,other,Venture capitalist and tech investor; Epstein academic network contact.,,0,5,0,No,Canadian-American
Paul Krassner,other,American satirist and founder of The Realist magazine who corresponded with Epstein and received personal financial support from him.,,0,387,0,No,
Paul M. Daugerdas,associate,Defendant in the case.,Daugerdas; Paul Daugerdas,0,93,0,No,
Paul Morris,business,Deutsche Bank managing director; Epstein's primary private banker (2013-2016),,0,29863,0,No,American
Paul Ryan,politician,Former House Speaker; on DOJ 305 list; no reported direct Epstein connection.,Ryan,0,225,0,No,American
Paul Shechtman,associate,Attorney for David Parse.,,0,11,0,No,
Paul Tudor Jones,business,Hedge fund manager listed in Epstein's black book.,Paul Tudor Jones II; Jones; Paul Jones,0,89,0,Yes,American
Paula A. Heil Fisher,associate,"Former Bear Stearns colleague and long-term girlfriend of Epstein; Broadway/opera producer who connected Epstein to conductor Frederic Chaslin and the Leese family; 404 documents, black book entry with 9 numbers.",Paula Heil Fisher; Paula Fisher; Paula Heil; Fisher,0,500,0,Yes,American
Paula Epsilon,associate,Passenger,,0,10,0,No,
Paula Garrity,other,Friend of Lesley Groff; wife of former NBA player Pat Garrity. Referenced in EFTA correspondence.,,0,406,0,No,American
Pavel Gurvich,military-intelligence,"IDF Unit 81 graduate and Guardicore co-founder; recruited by Barak to source offensive cyberweapons startups; Epstein pursued Rothschild Group funding for the pipeline, per Drop Site News.",,0,1,0,No,Israeli
Peg Ugland,business,Treasurer of Wexner Family Charitable Fund and Wexner Foundation; director of Epstein offshore entities.,,0,467,0,No,American
Peggy Siegel,socialite,NYC PR consultant who promoted Epstein social rehabilitation. Arranged screenings and political introductions.,Margaret Siegel,0,765,0,No,American
Perry Bard,other,"Dr. Perry Bard is a Palm Beach chiropractor and physical therapist who provided regular in-home chiropractic and physical therapy sessions to Epstein at his Palm Beach residence, coordinated through Lesley Groff.",,0,793,0,No,
Peter Attia,academic,"Physician and longevity author; 1,700+ DOJ document mentions, apologized for emails.","Peter Attia, M.D.; Pete Attia",0,2057,0,No,American
Peter Brant,business,Newsprint magnate listed in Epstein's black book.,Pete Brant,0,211,0,Yes,American
Peter Cook,other,Architect listed in Epstein's black book.,Pete Cook,0,130,0,Yes,American
Peter Dubinin,associate,Contact listed in Epstein's black book.,Pete Dubinin,0,0,0,Yes,American
Peter Gabriel,celebrity,"English musician, Genesis founder, and human rights activist listed in Epstein's black book.",Pete Gabriel,0,182,0,Yes,British
Peter Norvig,academic,Google Director of Research; mentioned in Epstein correspondence.,Pete Norvig,0,30,0,No,American
Peter Nygard,business,Fashion executive listed in Epstein's black book; later convicted.,Pete Nygard,0,36,0,Yes,Canadian
Peter Power,other,Mandelson spokesperson; mentioned in Mandelson-Epstein email.,Pete Power,0,2887,0,No,British
Peter St. Omer,associate,"Employee at Jeffrey Epstein's Little St. James island in the US Virgin Islands, listed in staff records as a building maintenance worker.",Peter Omer; Pete St. Omer,0,665,0,No,
Peter Thiel,business,Palantir co-founder with documented multi-year relationship with Epstein; dietary requirements sent to island staff for his visits; Epstein referenced Palantir as job option for Ehud Barak in recorded conversation.,Pete Thiel,0,2787,0,Yes,American
Petter Stordalen,business,Norwegian hotel billionaire; named in Norwegian Epstein scandal context.,Stordalen,0,0,0,No,Norwegian
Phil Collins,celebrity,Genesis frontman; in Epstein's black book with 3 numbers; named in December 2025 DOJ file release; no allegations.,Philip David Charles Collins,0,42,0,Yes,British
Philip Barden,associate,Personal assistant in Epstein's network.,,0,126,0,Yes,British
Philip Levine,politician,"Former Miami Beach mayor; 600+ EFTA mentions; emailed Epstein post-conviction calling him ""a great guy""; Maxwell named Levine a ""very good friend""",,0,681,0,No,American
Philippe JAIGLIF,associate,Chef du Bureau de l'Entraide Pénale Internationale.,Philippe JAIGLÉ,0,9,0,No,
Phillip Diaz,other,Epstein mentee; put through vocational school; Palm Beach documents.,,0,92,0,No,American
Physician Assistant (PA),associate,Conducted medical Intake Screening and History and Physical for Mr. Epstein.,Physician (PA),0,17,0,No,
Pia Salazar,associate,Attorney and donor,,0,6,0,No,
Pierre James,associate,"Employee connected to Epstein properties and operations, identified in case documents as a heavy machinery operator. His name appears in staff and payroll-related records linked to Epstein residences and the Virgin Islands operations.",,0,1734,0,No,
Pierre Jules,associate,Named $1M beneficiary in Epstein 1953 Trust.,,0,198,0,No,
Pierre N. Leval,associate,Circuit Judge,Leval; Pierre Leval,0,38,0,No,
Pierre Omidyar,business,"eBay founder; Santa Fe Institute trustee; attended Epstein dinner with Musk, Page, Brin, Pritzker.",,0,144,0,No,American
Pinchas Buchris,military-intelligence,Former Unit 8200 commander and Defense Ministry director general; served on Carbyne board; told Haaretz that Epstein's investment was deliberately concealed behind Barak's name.,,0,14,0,No,Israeli
Polina Sikorska,associate,"Ukrainian model and actress who recruited women for Epstein, traveled to his properties voluntarily, and received career advancement in exchange for her association.",Polina Sikorskaya; Polina Boyd,0,132,0,No,Ukrainian
Preet Bharara,associate,United States Attorney.,,0,68,0,No,
Prince Albert of Monaco,royalty,Sovereign Prince of Monaco.,Albert II; Monaco; Albert of Monaco,0,219,0,Yes,Monegasque
Prince Bandar bin Sultan,royalty,Former Saudi Ambassador to U.S. listed in Epstein's black book.,Bandar Bush; Sultan; Bandar bin Sultan,0,92,0,Yes,Saudi
