Name,Category,Bio,Aliases,Flights,Documents,Connections,In Black Book,Nationality
Barbra Streisand,celebrity,Singer/actress; on DOJ 305 list of names appearing in released files; no direct Epstein connection reported.,Streisand,0,1,0,No,American
Barbro Ehnbom,business,Founder of BBB mentoring network; connected young Swedish women to Epstein.,Barbro C. Ehnbom; Barbro C Ehnbom; Barbro Ehrnbom,0,1418,0,No,Swedish
Barnaby Marsh,other,"Philanthropy strategist and Templeton Foundation executive who attended two dozen Epstein salon dinners (2013-2017); introduced Deepak Chopra to Epstein; mentioned 4,600+ times in the files.",,0,3219,0,No,
Baron Jean de Gunzburg,socialite,French aristocrat listed in Epstein's black book.,Gunzburg; Jean de Gunzburg,0,1,0,Yes,French
Barry Cohen,business,Apollo Global executive; co-executor of Leon Black's estate; trustee of Black's APO 1 GRAT ($28M+),,0,2294,0,No,American
Barry Diller,business,Media executive listed in Epstein's black book.,,0,148,0,Yes,American
Barry H. Berke,legal,Top defense attorney; named in EFTA legal documents.,Barry Berke; Berke,0,11,0,No,American
Barry Josephson,celebrity,"Hollywood producer (Bones, Enchanted); DOJ emails show loans, crude exchanges with Epstein; public apology issued Feb 2026.",Barry & Jackie Josephson,0,1928,0,Yes,American
Barry Krischer,legal,Former Palm Beach State Attorney criticized for handling of Epstein case.,,0,415,0,No,American
Basillia Morales-Mercado,associate,Head housekeeper at LSJ.,Basillia Morales; Basillia Mercado,0,33,0,No,
"Beaudouin, Robert MD",associate,Prescribing Doctor,"Beaudouin, MD; Beaudouin, Robert",0,9,0,No,
Bebe Avdiu,associate,"Legal assistant to Epstein lawyer Darren Indyke; appears in 4,558 EFTA documents; coordinated legal, financial, and household logistics on Epstein's behalf.",,0,4834,0,No,
Beef Knuckles,associate,Friend or acquaintance of the profile owner.,,0,26,0,No,
Bella Klein,associate,"Epstein accountant, 00K beneficiary in his will; daughters' tuition paid by Epstein; subpoenaed in USVI lawsuit.",,0,25688,0,No,American
Ben Shapiro,celebrity,Daily Wire founder; on DOJ's February 2026 305-name list via media clippings; critic of Epstein conspiracy theories.,Shapiro; Benjamin Shapiro,0,39,0,No,American
Ben Stiller,celebrity,Actor and filmmaker; 2 numbers in Epstein's black book; mentioned in 2024 unsealed Maxwell documents; no allegations.,Benjamin Edward Meara Stiller; Benjamin Stiller,0,36,0,Yes,American
Benjamin Netanyahu,politician,Israeli Prime Minister; appears in 515 Epstein documents primarily as political context; Epstein's ties to rival Ehud Barak created political complications; disputed Mossad claims in 2026 FBI memo.,Netanyahu; Bibi; Ben Netanyahu,0,515,0,No,Israeli
Benjamin Wegg-Prosser,business,Global Counsel CEO; met Epstein post-conviction to discuss business plan; resigned Feb 2026.,Ben Wegg-Prosser; Benjamin Wegg; Benjamin Prosser,0,54,0,No,British
Bennett L. Gershman,associate,Expert witness,Gershman; Bennett Gershman,0,15,0,No,
Bernard Arnault,business,"LVMH chairman; Epstein claimed ""very close mutual friends"" in 2018 Bannon iMessage; black book (4 phones)",,0,20,0,Yes,French
Bernard L. Schwartz,associate,CEO,Schwartz; Bernard Schwartz,0,60,0,No,
Bernard Madoff,associate,Convicted financier who asked President Trump to reduce his prison sentence.,,0,105,0,No,
Bernard Rapoport,associate,Philanthropist,,0,8,0,No,
Bernie Ecclestone,business,Former Formula One chief listed in Epstein's black book.,Bernard Charles Ecclestone,0,6,0,Yes,British
Bernie Steinberg,academic,Former Harvard Hillel director who solicited Epstein donations post-conviction.,Bernard Steinberg,0,12,0,No,American
Bert Sakmann,academic,German physiologist and 1991 Nobel laureate; met with Epstein at Max Planck Institute.,,0,3,0,No,German
Beyonce,celebrity,Music icon; on DOJ 305 list; husband Jay-Z named in separate unverified 2019 FBI tip; no direct Epstein connection reported.,Beyonce Knowles; Beyonce Knowles-Carter,0,0,0,No,American
Bill Berkman,business,New York businessman,William Berkman,0,36,0,No,
Bill Cosby,associate,comparator high-profile defendant.,William Cosby,0,159,0,No,
Billy Barou,associate,Commenter on a social media profile.,,0,3,0,No,
Billy Dimauro,associate,Likely Epstein co-pilot; appeared on 2 flights in 2013.,,2,15,0,No,
Billy G. Smith,associate,Horseman/taxi service owner.,Smith; Billy Smith,0,3,0,No,
Blaine Trump,socialite,"American socialite and philanthropist, former wife of Robert Trump, making her Donald Trump's ex-sister-in-law. Listed in Jeffrey Epstein's contact black book. Blaine Trump was active in New York charity circles and high-society philanthropy throughout the 1990s and 2000s, a world that overlapped with Jeffrey Epstein and Ghislaine Maxwell's social network. She and Robert Trump divorced in 2008 after more than 20 years of marriage.",,0,282,0,Yes,American
Bob Colacello,other,Journalist and author listed in Epstein's black book.,Robert Colacello,0,38,0,Yes,American
Bob Denham,legal,Attorney listed in Epstein's black book.,Robert Denham,0,12,0,Yes,American
Bob Weinstein,business,Film producer; 4 black book numbers; brother of Harvey Weinstein; no Epstein-related allegations.,Robert Weinstein,0,256,0,Yes,American
Bob Wright,business,Former NBC Universal CEO listed in Epstein's black book.,Robert Charles Wright; Robert Wright,0,40,0,Yes,American
Bobby Kotick,business,American businessman and former CEO of Activision.,,0,136,0,No,
Bobby Slayton,celebrity,"American stand-up comedian; listed in Epstein's black book and documented in scheduling emails for visits to Epstein's Manhattan home; attended dinners with Epstein, Woody Allen, and Soon-Yi Previn.",Robert Slayton,0,517,0,Yes,American
Bojana Banjac,person-of-interest,,,0,3,0,No,
Bono,celebrity,"U2 vocalist; listed in black book; referenced in files via philanthropy work, a Mick Jagger anecdote, and Broadway musical; no allegations.",Paul David Hewson,0,0,0,Yes,Irish
Borge Brende,business,World Economic Forum CEO under investigation for Epstein dinners.,Børge Brende,0,113,0,No,Norwegian
Boris Collardi,business,Former CEO of Julius Baer who participated in Epstein-brokered secret merger talks with Edmond de Rothschild bank in 2017.,,0,200,0,No,Swiss
Brad Karp,legal,Paul Weiss chairman who helped Epstein with plea strategy; resigned Feb 2026.,Brad S. Karp,0,1647,0,No,American
Brad Nowell,associate,"Lead singer of Sublime, deceased musician.",,0,4,0,No,
Brad Wechsler,business,IMAX co-founder; managed Leon Black's family office.,Bradley Wechsler; Bradley J. Wechsler,0,5140,0,No,
Bradley Gillin,business,"Deutsche Bank VP; processed Epstein's KYC remediation, FinCEN filings, and wire transfers.",,0,2782,0,No,American
Bradley T Gross,associate,Forwarded correspondence to Bureau of Prisons Acting Director Hugh Hurwitz; connected to federal communications surrounding Epstein's 2019 MCC detention.,Gross; Bradley Gross,0,2702,0,No,
Bran Ferren,business,"Artist, former Disney executive.",,0,76,0,No,
Brendan Henry,associate,Paralegal identified in deposition testimony from the civil case 1:20-cv-00338 as a member of the legal team working on Epstein-related proceedings. Witness testimony from the Brune deposition names Brendan Henry alongside attorneys and other paralegals including Melissa Desori and David Elbaum as participants in the legal work on the matter.,,0,654,0,No,
Brian F. Egolf,associate,Oil and gas executive.,Egolf; Brian Egolf,0,3,0,No,
Brian Roberts,business,Comcast CEO listed in Epstein's black book.,,0,121,0,Yes,American
Brian Vickers,celebrity,Former NASCAR driver; married Epstein co-conspirator Sarah Kellen; direct emails with Epstein in EFTA files.,Brian L. Vickers,0,303,0,No,American
Brice Gordon,associate,"NZ property manager for Epstein islands (2003-2019), $2M trust beneficiary.",Brice M. Gordon; Brice Gordon; B. Gordon; Gordon,0,11508,0,No,New Zealander
Brigid Macias,business,Deutsche Bank AVP; processed wire transfers and currency orders for Epstein accounts.,,0,906,0,No,
Brock Pierce,business,Tether co-founder with extensive documented Epstein contact (2010-2019),,0,2371,0,No,American
Bruce A. Green,associate,Professor and expert witness in Giuffre v. Dershowitz.,Green; Bruce Green,0,230,0,No,
Bruce Castor,associate,Former District Attorney who made a promise not to prosecute Cosby.,,0,30,0,No,
Bruce Moskowitz,other,Epstein's Palm Beach physician; received $220K from Epstein; co-founded Moskowitz Foundation.,,0,1592,0,No,
Bruce Springsteen,celebrity,"Rock musician (""The Boss""); on DOJ 305 list; 1 doc and 3 emails in files as indirect social references only.",Springsteen; The Boss,0,2,0,No,American
Bruce Willis,celebrity,"Actor (Die Hard, Pulp Fiction); 2 black book numbers; Sjoberg testified in Giuffre v. Maxwell that Epstein name-dropped him but she never met Willis through Epstein; no allegations.",Walter Bruce Willis,0,104,0,Yes,American
Bruno Le Maire,politician,Former French Finance Minister who visited Epstein's New York residence; Epstein's associates attempted to arrange political fundraising through the connection.,Maire; Bruno Maire,0,47,0,No,French
Bryan Bishop,business,Bitcoin developer who pitched Epstein on designer baby venture in 2018.,,0,113,0,No,American
Burt Minkoff,politician,Listed contact in Epstein's black book.,,0,1,0,Yes,American
Byron Elrod,associate,Person with whom the missing juvenile was allegedly associating.,,0,4,0,No,
C. Edge,associate,"Unclear, possibly a staff member or investigator.",,0,300,0,No,
C. Iali,associate,Visitor to Jeffrey Epstein.,,0,22,0,No,
CLAUDIUS ENGLISH,associate,"Defendant charged in multiple federal indictments filed in the Southern District of New York between 2013 and 2018 with sex trafficking of minors, attempted sex trafficking, kidnapping a minor victim while armed, and recruiting and enticing minors. His case files appear in the DOJ document release alongside Epstein-related prosecutorial records from the same era and jurisdiction.",,0,1275,0,No,
CMC (Case Management Coordinator),associate,Notified next of kin and handled various tasks related to Epstein's death.,Coordinator); CMC Coordinator),0,6,0,No,
Cameron Diaz,celebrity,Actress; name-dropped by Epstein per Johanna Sjoberg deposition testimony (January 2024 unsealing); Sjoberg stated she never met Diaz through Epstein; Diaz denies any association or meeting with Epstein.,Cameron Michelle Diaz,0,147,0,No,American
Camilla Reksten-Monsen,associate,"IPI Chief of Staff who served as the primary liaison between Terje Rod-Larsen and Jeffrey Epstein, transmitting sensitive institutional documents and coordinating meetings over nearly a decade.",Camilla Reksten Monsen; C. Reksten-Monsen; Camilla Reksten; Camilla Monsen,0,357,0,No,Norwegian
Camille S. Biros,associate,Claims administration expert and partner to Ms. Feldman.,Biros; Camille Biros,0,50,0,No,
Canning Fok,business,Li Ka-Shing's right hand; Hong Kong executive; financial dealings with Epstein.,,0,50,0,No,Chinese (Hong Kong)
Carl Icahn,business,Billionaire investor listed in Epstein's black book.,,0,144,0,Yes,American
Carl Roderfer,associate,Pilot,,0,2,0,No,
Carl Sputh,associate,Captain of Epstein's 178-foot Benetti superyacht Starfire (valued at $26M). Previously captained the same vessel unde...,Captain Sputh; Captain Carl Sputh; Capt. Carl Sputh,0,3,0,No,American
Carla Bruni,celebrity,"French model, singer, and former First Lady of France (wife of Sarkozy); listed in Epstein's black book.",Carla Bruni-Sarkozy,0,30,0,Yes,Italian-French
Carlos Gallegos Jr.,associate,Santa Fe businessman and donor.,Carlos Jr.; Carlos Gallegos,0,3,0,No,
Carlos Rodriquez,associate,Head boat captain,,0,103,0,No,
Carlos Slim,business,Mexican billionaire telecom magnate listed in Epstein's black book; no direct correspondence found.,Carlos Slim Helu,0,282,0,Yes,Mexican
Carluz Toylo,associate,Long-time houseman and caretaker at Epstein's Palm Beach residence at 358 El Brillo Way. Named alongside his wife Arline as a $1 million beneficiary in Epstein's 1953 Trust.,,0,1550,0,No,
Carly Simon,celebrity,Singer-songwriter; 3 black book numbers; Vineyard resident; sister Joanna also listed; no allegations.,,0,275,0,Yes,American
Carmen Rodgers,associate,Housekeeper,,0,435,0,No,
Carol Alt,celebrity,Supermodel and actress (700+ magazine covers); listed in Epstein's black book.,,0,65,0,Yes,American
Caroline Kitidis,business,Deutsche Bank Head of Key Client Partners; visited Epstein's mansion during client courtship in 2013.,,0,969,0,No,American
Caroline Lang,associate,"French film producer and daughter of Jack Lang; co-owned offshore company Prytanee LLC with Epstein, named in his will for $5 million.",,0,1546,0,No,French
Carrie Yackee,associate,Sender of emails and faxes.,,0,6,0,No,
Casey Tegreene,business,"Intellectual Ventures patent chief; in EFTA email thread with Walker, Gates.",,0,15,0,No,American
Cassandra Macdonald,other,"Formerly Cassandra Fairbanks, American journalist, has worked for Russian state-owned news agency Sputnik (2015-2017)...",,0,6,0,No,
Cate Blanchett,celebrity,Australian actress; name-dropped by Epstein per witness Sjoberg testimony; no actual connection confirmed.,Catherine Elise Blanchett,0,57,0,No,Australian
Catherine Conrad/Rosa,associate,Individual with multiple criminal records.,,0,3,0,No,
Catherine Morgan Conrad,associate,Person who authored a note that became Court Exhibit 3.,Conrad; Catherine Conrad,0,143,0,No,
Catherine Schmid-Maybach,other,"Member of the Maybach automotive family whose $50,000 wire transfer appears in Deutsche Bank records connected to Epstein financial entities.",Catherine Schmid Maybach; Catherine Schmid; Catherine Maybach,0,32,0,No,American
Cathy Alexander,associate,Co-manager of Epstein's Little St. James island alongside husband Miles Alexander (1999-2007),,0,492,0,No,South African
Cecile de Jongh,associate,Wife of USVI Governor John de Jongh; JPMorgan alleged she was Epstein's primary conduit for spreading money and influence throughout the Virgin Islands government.,Jongh; Cecile Jongh,0,8701,0,No,American
Cecilia Steen (Duplicate),associate,Employee,(Duplicate); Cecilia (Duplicate); Cecilia Steen,0,420,0,No,
Charisma Edge Lamine,associate,Subject of discussion or investigation.,Lamine; Charisma Lamine,0,107,0,No,
Charisma Owens,associate,Sender of the email,,0,93,0,No,
Charles Althorp,other,Princess Diana's brother.,Charlie Althorp; Chuck Althorp,0,3,0,No,
Charles Delevingne,socialite,Property developer listed in Epstein's black book.,Charlie Delevingne; Chuck Delevingne,0,0,0,Yes,British
Charles Edward Small,other,Person of interest and romantic partner of Mary Small; linked to the recruitment of a trafficking victim around 2001 to 2002 via a 2023 FBI memorandum. Also appears in Virgin Islands financial records.,Small; Charles Small; Charlie Edward Small; Chuck Edward Small,0,2195,0,No,
Charles Gasparino,other,Financial journalist listed in Epstein's black book.,Charlie Gasparino; Chuck Gasparino,0,0,0,Yes,American
Charles Harper,academic,Scientist/theologian; met Epstein to discuss science; EFTA01822442.,Charlie Harper; Chuck Harper,0,166,0,No,American
Charles Johnson,other,Media figure; FBI 302 witness alleging Epstein-Israeli intelligence connections.,Chuck Johnson; Charles C. Johnson; Charlie Johnson,0,113,0,No,American
Charles McGonigal,military-intelligence,Former FBI New York counterintelligence chief; convicted of conspiring with sanctioned Russian oligarch Oleg Deripaska; sentenced to 50 months; held jurisdiction over Epstein's Manhattan operations during 2016-2018.,McGonigal; Charlie McGonigal; Chuck McGonigal,0,20,0,No,American
Charles Shank,academic,Former LBNL director; Epstein seminar participant; received Epstein funding.,Charlie Shank; Chuck Shank,0,28,0,No,American
Charles Spencer,socialite,9th Earl Spencer listed in Epstein's black book.,9th Earl Spencer; Charlie Spencer; Chuck Spencer,0,144,0,Yes,British
Charlie Crist,politician,Florida Governor (2007-2011); Epstein sought clemency from him before leaving office.,Charles Crist; Governor Crist; Charlie Crist Jr.,0,30,0,No,
Chelsea Clinton,politician,"Vice Chair, Clinton Foundation; Maxwell attended her 2010 wedding.",Chelsea Victoria Clinton; Chelsea Clinton Mezvinsky,0,428,0,No,American
Chelsea Handler,celebrity,Comedian; attended Epstein's December 2010 dinner for Prince Andrew; called it awkward; only known encounter.,,0,44,0,No,American
Cher,celebrity,"Singer/actress (""Goddess of Pop""); on DOJ 305 list; likely cited in media or entertainment content in files; no direct connection.",Cherilyn Sarkisian,0,0,0,No,American
Chief Psychologist,associate,Psychologist at MCC New York who evaluated Epstein.,,0,530,0,No,
Chip Packard,business,"Head of Deutsche Bank Wealth Management Americas; approved Epstein as a client, named in NYDFS $150M fine.",Charles Packard; Charles 'Chip' Packard,0,851,0,No,American
Chris Dodd,politician,"Former CT senator and MPAA chairman; received and returned $1,000 Epstein campaign donation in 2003-2006; listed in Epstein black book.",Christopher John Dodd; Christopher Dodd,0,403,0,Yes,American
Chris Wagner,associate,Listed in Epstein's aircraft phone billing records; likely a flight operations contact or supervisor associated with Epstein's air travel network. Also cited as Pilot-in-Command in related flight documents.,Christopher Wagner,8,1563,0,No,
Christian Kjaer,associate,Danish businessman; owned Great St. James island; Epstein used fraud to circumvent his refusal to sell.,,0,31,0,No,Danish
Christie Brinkley,celebrity,Supermodel; listed in Epstein's black book; Hamptons social scene overlap.,,0,86,0,Yes,American
Christina Pryor,military-intelligence,"FBI Special Agent on the 2006 federal Epstein investigation; early reports documented ""ample proof"" of crimes; later reviewed Alfredo Rodriguez's victim journal; referenced in EFTA01326139.",,0,84,0,No,American
Christine Mazzella,associate,Special Agent - IRS,,0,2,0,No,
Christine Murray,associate,NYSD court staff or clerk.,,0,157,0,No,
Christof Koch,academic,Neuroscientist who attended Epstein's 2011 island Mindshift Conference.,,0,179,0,No,American
Christopher Mason,other,Journalist listed in Epstein's black book.,Chris Mason,0,344,0,Yes,British-American
Christopher Sheehan,associate,Landscape Manager,Chris Sheehan,0,47,0,No,
Chuck Schumer,politician,Senate leader; championed Epstein transparency bill; on DOJ 305 list via news clippings.,Schumer; Charles Schumer,0,95,0,No,American
Chuck Yeager,associate,Referenced in a Myspace profile comment.,Charles Yeager,0,7,0,No,
Cindy Crawford,celebrity,Supermodel; 3 black book numbers; named in Epstein social diary documents at industry events.,Cynthia Ann Crawford,0,97,0,Yes,American
Clare Probert,associate,Executive Assistant to Mort Zuckerman; scheduled Epstein-Zuckerman meetings over a 10-year period.,,0,159,0,No,
Clarence Thomas,other,Associate Justice of the Supreme Court of the United States.,,0,44,0,No,
Claudia Schiffer,celebrity,German supermodel; appears in 4 DOJ documents; no confirmed black book listing; no allegations.,,0,4,0,Yes,German
Cledus McTavern,associate,Myspace user commenting on someone's profile.,,0,11,0,No,
Clint Hope,other,Technology consultant connected to Bran Ferren and Danny Hillis. Recommended to Epstein in December 2009 by Dan Dubno as a resource for encryption and decryption consulting.,,0,2030,0,No,American
Colleen Maloof,associate,Business owner,,0,7,0,No,
Conchita Sarnoff,other,Investigative journalist; broke Epstein story for Daily Beast 2010; author of TrafficKing.,,0,72,0,No,American
Connie Rodgers,associate,Pilot,,0,433,0,No,
Conrad Black,business,Media baron; former owner of the Daily Telegraph.,Lord Black of Crossharbour,0,227,0,Yes,Canadian-British
Conrad Hilton,business,Hotel heir listed in Epstein's black book.,Barron Hilton,0,61,0,Yes,American
Corina Tarnita,academic,Princeton ecologist mentioned 344+ times in Epstein DOJ files.,Corina Elena Tarnita,0,241,0,No,Romanian-American
Cory Booker,politician,NJ Senator; named on Observer gala invitation sent to Epstein in 2013.,Booker,0,60,0,No,American
Cosima von Bulow,socialite,Socialite listed in Epstein's black book.,Cosima Pavoncelli; Bulow; Cosima Bulow,0,3,0,Yes,American
Cosmo Fry,socialite,Socialite listed in Epstein's black book.,,0,16,0,Yes,British
Courtney Love,celebrity,"American rock musician (Hole), actress, and widow of Kurt Cobain. Listed in Epstein's black book with three phone numbers; her name was circled by former house manager Alfredo Rodriguez. In a 2010 MTV interview, warned young women not to accept limousine rides from Epstein; the clip resurfaced after his 2019 arrest. Named as proposed panelist for an Epstein-linked science-culture series. No allegations of wrongdoing.",Courtney Michelle Love,0,485,0,Yes,American
Craig Venter,academic,Genome scientist; synthetic biology pioneer; connected through Edge Foundation science network.,J. Craig Venter,0,319,0,No,American
Crew members,associate,Pilots or crew operating aircraft N722JE.,,0,3930,0,No,
Crown Princess Mette-Marit,royalty,"Crown Princess of Norway; 1,000+ mentions in Epstein files, publicly apologized.",Mette-Marit Tjessem Hoiby; Mette-Marit Tjessem Høiby; Mette; Kronprinsessen; H.K.H. Kronprinsessen; HKH Kronprinsessen; Mette-Marit; Crown Mette-Marit; Crown Princess Mette; Crown Princess Marit,0,50,0,No,Norwegian
Cuthbert Titre,other,"Employee at Jeffrey Epstein's Little St. James island, nicknamed Smiley, responsible for pool maintenance and reverse osmosis plant operations.",,0,268,0,No,
Cy Vance,legal,Former Manhattan DA whose office sought to lower Epstein's sex offender status.,Cyrus Roberts Vance Jr.,0,71,0,No,American
Cynthia Rodriguez,business,"Deutsche Bank Associate; replaced Amanda Kirby on Epstein accounts, handled High Risk KYC approvals (2016-2018)",,0,2705,0,No,
Cédric Villani,academic,Fields Medal mathematician and former French MP who met Epstein but cut contact after discovering his criminal history.,,0,60,0,No,French
D. Mebane,associate,Case manager at MCC NY.,,0,35,0,No,
DOJ Redaction,associate,The individual whose personal information is contained in the document.,,0,28,0,No,
Dan Ariely,academic,Duke behavioral economist named 636 times in Epstein DOJ files.,Daniel Ariely,0,750,0,No,Israeli-American
Dan Dubno,business,Multi-Emmy-winning CBS/PBS producer and technologist. Appears in 338 EFTA documents. Regular correspondent with Epste...,Daniel Dubno,0,436,0,No,American
Dan Quayle,politician,Former VP; chairman at Cerberus Capital (360 Epstein file mentions); on DOJ 305 list.,Quayle; James Danforth Quayle; Daniel Quayle,0,23,0,No,American
Dangene McKay-Bailey,business,"Business owner in modeling, spa, and nightclub industries.",Dangene McKay; Dangene Bailey,0,14,0,No,American
Daniel Aronoff,associate,Sender of letters to David Parse.,Dan Aronoff,0,2,0,No,
Daniel D. Villanueva,associate,"Investor from Los Angeles, Calif.",Villanueva; Daniel Villanueva; Dan D. Villanueva,0,7,0,No,
Daniel Dennett,academic,Philosopher and cognitive scientist; flew on Epstein's plane to TED (deceased),Daniel Clement Dennett III; Dan Dennett,0,144,0,No,American
Daniel Kahneman,academic,"Nobel laureate psychologist; direct emails with Epstein, listed on seminar attendee lists.",Dan Kahneman; Danny Kahneman,0,336,0,No,Israeli-American
Daniel Redefie,associate,Pilot,Dan Redefie,0,2,0,No,
Daniel Rodgers,associate,Pilot,Dan Rodgers,0,457,0,No,
Daniel Sabba,business,"Deutsche Bank Director; had direct personal contact with Epstein, sent confidential market intelligence.",Dan Sabba,0,2729,0,No,Brazilian
Daniel Siad,associate,Swedish-Algerian model scout who ran Epstein recruitment operations across Eastern Europe from Poland to Bulgaria. Criminal complaint filed in France in February 2026.,Amar Siad; Daniel Amar Siad; Siad Amar; Dan Siad,0,2419,0,No,
Danny Hillis,academic,Computer scientist who connected Epstein with MIT Media Lab; attended 2015 meeting with Epstein and Joi Ito.,W. Daniel Hillis,0,2133,0,Yes,American
Danny Vicars,associate,Danny Vicars served as a maintenance supervisor at Epstein's Little St. James island compound (LSJ) and is listed in staff employment records as part of the permanent island team.,,0,1324,0,No,
Daphne Wallace,associate,USVI-based financial manager for Epstein (2010-2019); $1M beneficiary of Epstein's final trust.,,0,14326,0,No,American
Daria Burak,associate,"Novosibirsk model who became Epstein's full assistant by 2019, screening candidates and organizing travel. Brought her 18-year-old sister to Epstein one week before his arrest.",,0,8,0,No,Russian
Darrin Howard,associate,Regional Counsel for the Federal Bureau of Prisons whose emails were searched in a New York Times FOIA lawsuit about the circumstances of Jeffrey Epstein's death at MCC New York.,,0,290,0,No,
Dasha Zhukova,socialite,Russian-American art dealer and socialite; ex-wife of Roman Abramovich; photographed with Ghislaine Maxwell.,Darya Alexandrovna Zhukova,0,83,0,No,
Dashawn Robertson,associate,Defendant,,0,107,0,No,
Dave Rodgers,associate,Pilot and flight operations coordinator for Epstein aircraft. Handled crew visas and landing permits.,,0,1972,0,No,American
David A. Ross,other,Former Whitney Museum director; post-conviction Epstein friend; resigned Feb 2026.,David Ross; Dave A. Ross,0,467,0,No,American
David Benhamou,associate,Non-attorney personnel on the case.,Dave Benhamou,0,6,0,No,
David Bowie,celebrity,Legendary British musician (deceased January 2016). Listed in Epstein's black book. Name appears in DOJ files through press releases and media materials. No personal contact documented. No wrongdoing alleged.,David Robert Jones; Dave Bowie,0,106,0,Yes,British
David Copperfield,celebrity,Illusionist; 5 black book numbers; Giuffre testified he appeared aware of Epstein's conduct.,David Seth Kotkin; Dave Copperfield,0,366,0,Yes,American
