Name,Category,Bio,Aliases,Flights,Documents,Connections,In Black Book,Nationality
Jeffrey Epstein,other,Convicted sex offender; financier; died in custody August 2019.,Jeffrey Edward Epstein; Jeff Epstein,2027,736258,185,No,American
Ghislaine Maxwell,associate,Convicted sex trafficker serving 20 years; Epstein's closest associate and primary recruiter; Supreme Court declined appeal Oct 2025; transferred to minimum-security Texas facility; seeking Trump clemency.,G-Max,1139,20390,172,Yes,British
Sarah Kellen,associate,Epstein's primary scheduler; named co-conspirator with immunity in 2008 NPA; 364+ flights; House Oversight requested voluntary interview June 2025; divorced NASCAR driver Brian Vickers April 2025.,Sarah Kellen Vickers; Sarah Lyn Kensington,672,636,110,Yes,American
Adriana Ross,associate,Polish former model; Epstein assistant; named co-conspirator granted immunity in 2008 NPA.,Adriana Mucinska,145,138,54,Yes,Polish
Larry Visoski,associate,Epstein's chief pilot for 28 years; key Maxwell trial witness; confirmed passengers.,Lawrence Visoski; Lvjet; LVJET; lvjet@aol.com,439,27453,51,Yes,American
Andrea Mitrovich,associate,Personal contact listed in Epstein's black book.,,93,31,47,Yes,American
Igor Zinoviev,associate,Russian MMA fighter (UFC veteran); Epstein bodyguard who was present during victim visits.,,23,139,47,Yes,Russian-American
Nadia Marcinkova,associate,Slovak-born Epstein associate brought to US as a teenager; named co-conspirator with immunity in 2008 NPA; became licensed pilot; revealed as federal cooperator providing information to DOJ 2018-2022.,Nadia Marcinko; Global Girl,267,1091,44,Yes,Slovakian
Emmy Tayler,associate,Personal assistant to Ghislaine Maxwell.,Emmy Taylor,200,57,35,Yes,British
Lesley Groff,associate,"Epstein's executive assistant for two decades; named co-conspirator with immunity; name appears 157,000+ times in DOJ files; House Oversight summoned for transcribed interview June 2026.",Katherine Lesley Taylor; Lesley Taylor,92,202665,35,Yes,American
Eva Andersson-Dubin,socialite,"Swedish physician, former Miss Sweden 1980, ex-girlfriend of Epstein; 6 black book numbers; testified at Maxwell trial; 2026 DOJ files show 2010 email inviting Epstein to visit when teenage daughter had friends over.",Eva Dubin; Eva Andersson,61,6941,33,Yes,Swedish-American
Celina Dubin,social,"Daughter of Glenn Dubin and Eva Andersson-Dubin, named as beneficiary of a $50M Epstein trust in 2014 and listed on 35 flights.",Celine Dubin,35,118,28,No,American
Jean-Luc Brunel,associate,French modeling agent who co-founded MC2 with Epstein funding; died by suicide in French custody Feb 2022; French prosecutors reopened probe Feb 2026.,,51,493,28,Yes,French
Bill Clinton,politician,"42nd President; 26+ Epstein flight legs documented; testified before House Oversight Feb 27, 2026.",William Jefferson Clinton; William Clinton,63,3584,26,Yes,American
Cindy Lopez (Buklarewicz),associate,Observer/Crew member,(Buklarewicz); Cindy (Buklarewicz),37,4,26,No,
Brent Tindall,staff,"Personal chef for Epstein in 2004, appearing on 60 flights and identified in FBI FD-302 interview documents as household staff.",Brent Tyndall,60,4,23,No,American
Darren Indyke,associate,Epstein personal attorney and estate co-executor; agreed to 25-35M settlement with survivors Feb 2026; subpoenaed to testify before House Oversight Mar 2026.,,18,35987,23,Yes,American
Doug Band,politician,Clinton's senior aide; 59 logged Epstein flights (2001-2004); Edwards affidavit cites him as traveling more than any other Clinton associate; Epstein stored Clinton's 21 phone numbers under Band's name.,Douglas Jay Band,59,682,23,Yes,American
Gary Roxburgh,associate,Contact listed in Epstein's black book.,,37,66,23,Yes,American
Bill Hammond,associate,Florida pilot on Epstein's Gulfstream and Boeing 727 fleet.,BH; William Hammond,66,558,22,No,American
Caren Casey,associate,Flight attendant on Epstein's private aircraft fleet.,,11,274,22,Yes,American
Gwendolyn Beck,associate,"Former girlfriend of Jeffrey Epstein and a figure in his social and professional network during the period of his financial rise in New York. Beck appears in documents and correspondence filed in civil proceedings related to the Epstein case. She was part of the circle of women connected to Epstein during the 1980s and 1990s, a period when Epstein cultivated relationships with wealthy and influential individuals while building his investment management operation.",,30,445,22,Yes,American
Jordan Dubin,other,Son of Glenn and Eva Dubin; mentioned by Eva; Epstein was family godfather.,,21,124,22,No,American
Alan Dershowitz,legal,Harvard Law professor; Epstein defense attorney; Giuffre later acknowledged she may have misidentified him; lost CNN defamation appeal Aug 2025.,Al Dershowitz,45,2828,21,Yes,American
Jennifer Kalin,associate,Epstein associate linked to arranged marriage for his girlfriend.,Jennifer Ann Kalin,18,47,20,No,American
Ira Magaziner,politician,CEO of Clinton Health Access Initiative; flew on Epstein's Africa trip.,Ira Charles Magaziner,9,20,19,Yes,American
Sean Koo,business,Financial professional listed in Epstein's black book.,,12,15,19,Yes,American
Alfredo Rodriguez,associate,Epstein butler who stole the black book; convicted of obstruction; died 2015.,,280,1088,18,No,American
Casey Wasserman,business,LA28 Olympics chairman with documented Maxwell correspondence.,,16,234,18,No,American
Chris Tucker,celebrity,"American actor and comedian known for the Rush Hour franchise. Documented on 18 flight legs aboard Epstein's Boeing 727 during the September 2002 Clinton Foundation Africa trip, alongside Bill Clinton and Kevin Spacey. Listed in Epstein's personal birthday memoir submitted to the House Oversight Committee. Internal emails from July to August 2013 document continued social visits to Epstein's New York residence, including one with his son. No accusations of wrongdoing.",Christopher Tucker,18,326,18,No,American
Eric Nonacs,associate,Clinton Foundation Foreign Policy Advisor (2002-2007),,17,14,18,No,American
Gayle Smith,politician,Former Clinton NSC Senior Director for African Affairs and USAID Administrator.,,13,36,18,No,American
Kevin Spacey,celebrity,Academy Award-winning actor; 6 Epstein flights on 2002 Clinton Africa trip; photographed with Clinton in Dec 2025 DOJ release.,Kevin Spacey Fowler,18,322,18,Yes,American
Laura Wasserman,associate,Entertainment executive and Casey Wasserman's then-wife; traveled on Epstein's plane during the 2002 Africa trip.,,16,42,18,No,American
Teala Davies,associate,Epstein accuser; filed civil lawsuit; advocate for survivors.,,50,238,18,No,American
Donald Trump,politician,"45th/47th President; 3,000+ document mentions; DOJ withheld then released files containing assault allegation (Mar 2026)",Don Trump,10,3801,17,Yes,American
Prince Andrew,royalty,Stripped of all royal titles Oct 2025; arrested Feb 2026 on misconduct charges; settled Giuffre civil suit for approx 12M in 2022.,Duke of York; Andrew Albert Christian Edward,28,5530,17,Yes,British
Valdson Cotrin,associate,"Brazilian national listed in Epstein financial records as a recurring wire transfer recipient. Jeffrey Epstein made multiple wire payments to Cotrin through Deutsche Bank, and FedEx records show a shipment sent directly from Epstein to Cotrin in Paris in December 2002. Identified in customs enforcement records as a banker.",Valdson Vieira Contrin; Contrin; Valdson Contrin,14,2474,17,No,
Greg Bledsoe,other,Emergency physician and former Arkansas Surgeon General.,Gregory Bledsoe,5,18,16,No,American
Jim Kennedy,associate,Former Clinton Deputy Press Secretary and Clinton Foundation communications director.,James Kennedy,6,333,16,No,American
Natalya Malyshev,associate,Epstein recruiter; named defendant in Sarah Ransome's civil lawsuit.,Natalya Maryshov; Natasha Malyshev; Natasha,3,3,16,No,Russian
Rodney Slater,politician,Former U.S. Secretary of Transportation (1997-2001); appeared on Epstein flight manifests for the 2002 Africa trip.,,6,44,16,No,American
Sophie Biddle-Hakim,staff,"Massage therapist who worked for Epstein from the mid-1990s, appearing on 61 flights between his properties and purchasing a home with an Epstein loan.",Sophie Biddle; Sophie Hakim,61,0,16,No,American
Dana Burns,associate,Assistant to Maxwell and Brunel; appeared on 12+ Epstein flights; received immunity in 2008 NPA.,Kimberly Burns; DB; Dana Perry; Danna Perry; Dana Kimberly Burns; Kim Burns,12,109,15,No,American
Joel Pashcow,business,"Real-estate businessman, longtime Mar-a-Lago member.",,12,61,15,No,
Lana Catterton,associate,Appeared on 8+ Epstein flight manifests.,,8,0,15,No,
Ron Burkle,business,Billionaire investor listed in Epstein's black book and flight logs.,Ronald Wayne Burkle; Ronald Burkle,3,102,15,Yes,American
Catherine Derby,associate,Flew with Epstein's inner circle; Derby family linked to Epstein property management.,Katherine Darby,4,32,14,No,
Didier Cazaudumec,staff,"Vermont-based chef who appears on 32 Epstein flights, traveling alongside Epstein and associates as household staff.",Didier B. Cazaudumec,32,0,14,No,French
John Amerling,other,Lafayette Construction Services.,Jack Amerling,2,27,14,No,
Pralaya Cuomo,other,Sex trafficking survivor and advocate; appeared on 2 Epstein flights.,,3,134,14,No,American
Adam Perry Lang,celebrity,Epstein's personal chef (1999-2003); cooperated fully with FBI; traveled on Epstein's planes.,Adam PerryLang; Adam Lang,13,369,13,No,American
Lance Calloway,associate,Epstein's personal chef on Little St. James Island (2006-2009),,4,94,13,No,American
Larry Summers,politician,Former U.S. Treasury Secretary; former Harvard President.,Lawrence Henry Summers; Lawrence Summers,9,6886,13,Yes,American
Mandy Ellison,associate,Personal assistant listed in Epstein's black book.,,10,77,13,Yes,American
Mark Epstein,associate,Jeffrey's brother; 7 black book numbers; owned apartments used to house young women.,,19,38373,13,Yes,American
Tiffany Gramza,associate,Former beauty queen who worked as Epstein assistant.,,21,3,13,No,American
Alberto Pinto,other,French interior designer listed in Epstein's black book; Epstein visited his Paris studio at 11 rue d'Aboukir and commissioned him to design a private jet interior. Deceased.,,14,1357,12,Yes,French
David Mullen,associate,Epstein's private chef (2004-2005); interviewed by FBI; flew on Epstein's jet and lived at his properties.,Dave Mullen,23,346,12,No,American
Magali Blachon,staff,"French personal trainer and fitness coach from Toulouse who served as Epstein's personal trainer, appearing on 19 flights in 2002-2003.",Magale Blachou; Magali Blachon Bourgougnon; Macall Blachou,19,2,12,No,French
Michael Liffman,other,Appears on 28 Epstein flights and listed as a witness in civil litigation with 'knowledge of Defendant's conduct.',Michael Liffmann; Mike Liffman,28,2,12,No,
Tatiana Kovylina,social,"Russian fashion model who walked for Victoria's Secret and major designers, appearing on Epstein's flight logs in 2005.",,11,0,12,No,Russian
Clare Hazell-Iveagh,socialite,British socialite listed in Epstein's black book.,Countess of Iveagh; Clare Hazell; Clare Iveagh,40,0,11,Yes,British
Nadia Bjorlin,celebrity,Actress (Days of Our Lives); name in Epstein flight manifests circa late 1999; daughter of conductor Ulf Bjorlin; no documented ongoing connection; no allegations.,,2,30,11,No,Swedish-American
Shelley Lewis,associate,Former Epstein girlfriend; ran Chocolate Sauce Books children's book agency.,,39,115,11,Yes,American
Susan Hamblin,associate,Associate of Jeffrey Epstein who appears in his black book and email correspondence.,Sue Hamblin,11,83,11,Yes,
Vanessa Breuer,associate,Flew with Epstein's core inner circle in 2006.,,2,4,11,No,
Ryan Dionne,associate,Contractor who received wire payments from Epstein and is listed as a witness with potential knowledge of trafficking conduct.,,16,107,10,No,American
Celina Midelfart,socialite,Norwegian businesswoman and socialite.,,19,7,9,Yes,Norwegian
Ed Tuttle,politician,Architect and hotel designer in Epstein's network.,Edward Tuttle,9,41,9,Yes,American
Joe Pagano,business,Aspen VC; 9 black book numbers; documented visits to Epstein townhouse; decades-long acquaintance.,Joseph Pagano,5,1485,9,No,
Linda Pinto,associate,Paris-based interior designer who runs Cabinet Alberto Pinto following her brother's death in 2012. She managed Epstein's interior design projects from Paris and appeared on a March 2001 flight log alongside Virginia Roberts (Giuffre).,,8,1432,9,No,
Miles Alexander,associate,Property and operations manager of Epstein's Little St. James island (1999-2007),Miles Alexander Tooby,0,743,9,No,South African
Naomi Campbell,celebrity,British supermodel; flew on Epstein aircraft 3-5 times (2001-2003); active email contact 2003-2016 spanning 13 years; used Epstein as business intermediary for Victoria's Secret pitch; island visit confirmed; Fashion for Relief charity trustee ban (2024),,10,437,9,Yes,British
Walter Cronkite,celebrity,"CBS News anchor 1962-1981; appeared on Epstein flight log, Newark to St. Thomas, January 2007 (deceased 2009)",,1,27,9,No,American
Bill Gates,business,Microsoft co-founder; met Epstein 6+ times post-conviction; DOJ files include Epstein's unverified draft emails and financial support for an alleged Gates associate.,William Henry Gates III; William Gates,1,3465,8,No,American
David Boies,legal,Attorney who represented Virginia Giuffre and Epstein survivors; secured 290M JPMorgan settlement and 75M Deutsche Bank settlement in 2023.,David Boles; Dave Boies,4,769,8,No,American
David Rodgers,associate,Epstein pilot whose flight logs became key evidence.,,1,872,8,Yes,American
Juan Alessi,associate,Former house manager at Epstein's Palm Beach estate who testified at the Ghislaine Maxwell trial.,,2,556,8,Yes,American
Pete Rathgeb,staff,"Florida-based contract pilot who flew Epstein's aircraft on 22 flights, identified alongside primary pilots Rodgers, Visoski, Hammond, and Roxburgh.",Peter Rathgeb,22,9,8,No,American
Audrey Strauss,associate,Acting U.S. Attorney SDNY who brought the 2019 Maxwell indictment.,,0,749,7,No,
Bill Richardson,politician,"Former NM Governor and Clinton-era Energy Secretary; named by Giuffre; met Epstein 9+ times post-conviction; died Aug 9, 2023.",William Blaine Richardson III; William Richardson,6,1480,7,Yes,American
Felicia Taylor,celebrity,CNN/CNBC business anchor; in Epstein black book (p. 53) and 1996 flight logs; deceased 2023.,Felicia Rodrica Sturt Taylor,3,395,7,Yes,American
Forrest Sawyer,celebrity,"ABC/NBC News anchor, Peabody winner; appeared on an Epstein flight manifest.",Forest Sawyer,1,27,7,No,American
Juliette Bryant,associate,Alleged victim,,5,62,7,No,
Leon Black,business,Apollo Global Management co-founder; paid Epstein $170M (2012-2017); $62.5M USVI immunity settlement; deposition ordered in BofA survivor lawsuit March 2026.,,9,13674,7,Yes,American
Les Wexner,business,L Brands and Victoria's Secret founder; Epstein's primary financial patron; named FBI co-conspirator in 2019 document; deposed by House Oversight Committee February 2026.,Leslie Wexner; Leslie H. Wexner; Les Wexner,19,1519,7,Yes,American
Stefanie Tidwell,associate,Flew to Epstein's island in June 2006 alongside Ruslana Korshunova.,,2,0,7,No,
Steve Miller,academic,Mentioned in photos with other Harvard professors.,Steven Miller,2,168,7,No,
Warren Spector,business,Former Bear Stearns co-president; named in Epstein flight logs.,,2,77,7,No,American
Dawn Devito,staff,"Palm Beach massage contact listed in Epstein's black book, appearing on 37 flights from as early as September 1993.",Dawn James; Dawn James Devito,37,4,6,No,American
Ehud Barak,politician,Former Israeli PM and Defense Minister; extensive documented ties to Epstein including Israeli government-managed security at a Manhattan apartment where Barak regularly stayed.,,15,6050,6,Yes,Israeli
Ellen Spencer,socialite,Social contact listed in Epstein's black book.,,3,170,6,Yes,American
Henry Jarecki,associate,"Psychiatrist, Moviefone co-founder; black book (10 numbers); trafficking lawsuit.",Dr. Jarecki; Dr. Henry Jarecki,3,570,6,Yes,German-American
Jeff Schantz,associate,Attorney at J. Epstein and Company who served as co-trustee of the Epstein 2001 Trust and traveled on Epstein's aircraft.,Jeffrey Schantz,4,261,6,No,
Jerry Goldsmith,associate,Contacted Jeffrey Epstein on 05/21/04.,,1,92,6,No,
Lynn Forester de Rothschild,business,"CEO, E.L. Rothschild; black book with 6 numbers; court document emails.",Lynn Forester; Lady de Rothschild; Rothschild; Lynn Rothschild,6,347,6,Yes,American-British
Melanie Walker,academic,Neurosurgeon; key Epstein-Gates bridge; science advisor to both; DOJ emails show $6M funding request.,Melanie S. Walker; Dr. Melanie Walker,0,25,6,No,American
Minor Victim-3,associate,Alleged victim of sexual abuse.,,0,197,6,No,
Nina Zagat,business,Zagat Survey co-founder; flew on Epstein jet to TED 2002 with Pinker and Laybourne; multiple dining records.,Nina Safronoff Zagat,2,366,6,No,American
Peter Marino,other,Architect listed in Epstein's black book.,Pete Marino,4,116,6,Yes,American
Ruslana Korshunova,other,Kazakh supermodel who visited Epstein's island at 18; died in 2008 at age 20.,Ruslana Korshonova,1,6,6,No,Kazakhstani
Sandy Berger,politician,Former National Security Advisor; called Epstein after search warrant executed (deceased),Samuel Richard Berger,1,107,6,No,American
Andres Pastrana,politician,"Former President of Colombia; flew with Epstein, listed in black book.",Andres Pastrana Arango; Andrés Pastrana Arango; Arango; Andrés Arango,2,28,5,Yes,Colombian
CHRISTIAN R. EVERDELL,associate,Defense attorney at Cohen and Gresser LLP who represented Ghislaine Maxwell in her federal sex trafficking trial.,EVERDELL; CHRISTIAN EVERDELL,0,526,5,No,
Frederic Fekkai,celebrity,"Celebrity hairstylist; in Epstein flight logs (2000, 2002); his Fifth Avenue salon used by Epstein to pay for styling appointments for women in his circle.",,3,1468,5,No,French-American
Jes Staley,business,Former Barclays CEO permanently banned by UK FCA for misleading regulators about his close friendship with Epstein; fined 1.1 million pounds in July 2025.,James Edward Staley,6,11179,5,Yes,American
John Brockman,other,Literary agent; Edge Foundation president; Epstein funded 74% of Edge budget ($638K of $857K),Jack Brockman,1,3353,5,Yes,American
Jonathan Mano,associate,Certifying instructor.,,10,42,5,No,
Joulia Starodoumovit,associate,Appeared on 3 Epstein flights; no public information available.,,3,0,5,No,
Marvin Minsky,academic,AI pioneer named in Giuffre court filings; deceased.,,2,1031,5,No,American
Minor Victim-1,associate,One of the alleged victims of Maxwell and Epstein's abuse.,,0,173,5,No,
Minor Victim-2,associate,Another alleged victim of Maxwell and Epstein's abuse.,,0,180,5,No,
Nina Keita,associate,Niece of Ivory Coast President Ouattara; acted as Epstein's fixer connecting him to West African political leaders.,,1,548,5,No,Ivorian
Steven Pinker,academic,"Harvard cognitive scientist; flight logs, defense linguistic opinion, and Edge.org network connections to Epstein.",Steve Pinker,1,390,5,No,Canadian-American
Alan Greenberg,business,Bear Stearns chairman who hired and mentored Epstein in 1976 despite his lack of a college degree. Died 2014.,Ace Greenberg; Al Greenberg,2,437,4,Yes,American
Bobbi C. Sternheim,legal,Maxwell's lead defense counsel; Top Secret/SCI clearance; Tartaglione curcio counsel.,Bobbi Sternheim; Sternheim,0,739,4,No,
Brett Ratner,celebrity,Film director (Rush Hour trilogy); 5 black book numbers; named in Epstein emails and calendar entries in 2017-2018; departed Warner Bros in 2017 after sexual misconduct allegations.,,3,122,4,Yes,American
Flavio Briatore,business,F1 team boss and Billionaire club founder; 5 black book numbers; Monaco-London-NYC jet-set overlap with Epstein.,,1,33,4,Yes,Italian
Jim Worden,associate,Flew with Epstein's defense attorney Gerald Lefcourt during NPA negotiations.,James Worden,20,17,4,No,
Lara Elizabeth Pomerantz,associate,Assistant United States Attorney.,Pomerantz; Lara Pomerantz,0,164,4,No,
Lawrence Krauss,academic,"Physicist who defended Epstein post-conviction, organized his 2006 conference, and sought his advice on misconduct allegations.",Larry Krauss,1,6548,4,No,American
Mort Zuckerman,business,"Media mogul (NY Daily News, U.S. News) and Boston Properties co-founder; Epstein advised him on finances and leveraged their relationship to influence abuse coverage after 2008 conviction.",Mortimer Benjamin Zuckerman,4,3038,4,Yes,American
Nicole Junkermann,socialite,"German investor with deep, sustained 16-year connection to Epstein spanning flights, finances, and business.",,4,4372,4,Yes,German
Pepe Fanjul,business,Sugar magnate and Palm Beach billionaire.,Jose Fanjul,1,99,4,Yes,Cuban-American
Peter Listerman,associate,Russian businessman and model scout in Epstein's network.,Pete Listerman,0,19,4,Yes,Russian
Peter Mandelson,politician,British Labour politician; former European Commissioner and UK ambassador to the US; arrested Feb 2026 on suspicion of leaking market-sensitive government information to Epstein.,Baron Mandelson; Pete Mandelson,2,6991,4,Yes,British
Robert F. Kennedy Jr.,politician,"U.S. HHS Secretary; flew on Epstein's jet, listed in black book.",RFK Jr.; Bobby Kennedy; Robert Jr.; Robert F. Kennedy; Bob F. Kennedy Jr.; Rob F. Kennedy Jr.,2,64,4,Yes,American
Sarah Ferguson,royalty,Ex-wife of Prince Andrew; took 15K pounds from Epstein 2010; March 2026 DOJ files revealed she privately apologized to Epstein after publicly criticizing him.,Duchess of York; Fergie,3,776,4,Yes,British
Stephen Hawking,academic,Theoretical physicist who attended Epstein island conferences in 2006 and 2012; named in court filings.,,3,440,4,No,British
Sultan Ahmed bin Sulayem,business,DP World CEO; unredacted by Congress as one of six hidden names in Epstein files.,Sultan bin Sulayem; bin Sulayem; Sulayem; Ahmed bin Sulayem,0,4213,4,No,Emirati
Teddy Forstmann,business,Billionaire buyout pioneer; founder of IMG.,Theodore Joseph Forstmann,3,40,4,Yes,American
Alexander Acosta,legal,U.S. Attorney who approved Epstein 2008 NPA; resigned as Labor Secretary 2019; testified to House Oversight Sept 2025; denied discussing financial crimes.,Alex Acosta; R. Alexander Acosta,0,1917,3,No,American
Andy Stewart,associate,"Passenger, GM (General Manager)",Andrew Stewart,2,15,3,No,
Barbara Walters,celebrity,"Pioneering broadcast journalist (ABC News, 20/20, The View; deceased 2022). Listed in Epstein's black book with 3 phone numbers. Appeared on Peggy Siegal guest lists for Epstein-linked events 2011-2014. Maxwell reportedly boasted of their friendship to Virginia Giuffre.",,1,113,3,Yes,American
Boris Nikolic,academic,Gates's science advisor; introduced Gates to Epstein; named in Epstein's will.,,0,19442,3,No,Croatian-American
Bradley Edwards,legal,Victims attorney representing 50-plus survivors; helped secure 290M JPMorgan and 75M Deutsche Bank settlements; won Polaris Star Award 2024; fought DOJ redaction failures 2026.,Brad Edwards; Bradley J. Edwards; Bradley Edwards; Edwards,0,3921,3,No,American
Brian Mathis,business,Private equity investor; named in Epstein flight logs.,,1,10,3,No,American
Charlie Rose,celebrity,"TV journalist (PBS/CBS, 1991-2017); 4 Epstein black book entries; flight logs; hired 3 Epstein-referred assistants (one later accused him of harassment); attended 2010 post-conviction Epstein dinner with Prince Andrew; Epstein tracked his #MeToo fallout; fired 2017 for sexual misconduct (35+ accusers)",Charles Rose,2,1033,3,Yes,American
Clare Watts,associate,"Appeared on 17 Epstein flight manifests, likely cabin crew.",,17,131,3,No,
David Roth,associate,Contact of Jeffrey Epstein who corresponded directly with him and was identified as a friend of Stanley London.,Dave Roth,1,586,3,No,
Edgar Bronfman Sr.,business,Former Chairman of Seagram Company.,Edgar Sr.; Edgar Bronfman,2,80,3,Yes,Canadian-American
Elon Musk,business,CEO of Tesla and SpaceX; 16+ emails with Epstein revealed in DOJ EFTA release.,,0,1546,3,No,American
Gary Kerney,associate,"Construction professional listed in Epstein's black book; 2011 email shows Epstein instructed him to ""bury everything"" on the island.",,2,7331,3,No,American
George Mitchell,politician,Former U.S. Senate Majority Leader; 6 Epstein flights (2000-2004); named by Giuffre in court filings; Mitchell confirmed Epstein funded his philanthropic projects and organized a fundraiser.,George John Mitchell Jr.,6,515,3,Yes,American
George Stephanopoulos,celebrity,ABC News anchor; attended Epstein's December 2010 post-conviction dinner for Prince Andrew; publicly called it a mistake.,,2,66,3,Yes,American
Henry Kissinger,politician,Former Secretary of State; 4 black book numbers; attended post-conviction Epstein dinners.,Henry Alfred Kissinger,1,244,3,Yes,American
JEFFREY S. PAGLIUCA,associate,Denver defense attorney at Haddon Morgan and Foreman who was one of Ghislaine Maxwell's lead trial counsel.,PAGLIUCA; JEFFREY PAGLIUCA; Jeff S. PAGLIUCA,0,609,3,No,
Jack Scarola,legal,West Palm Beach victims' rights attorney; central figure in challenging the 2008 Epstein non-prosecution agreement on behalf of trafficking survivors.,John Scarola,0,1459,3,No,American
Jimmy Cayne,business,Former Bear Stearns CEO; Epstein previously worked at Bear Stearns.,James Cayne,2,328,3,Yes,American
Jose Maria Aznar,politician,Former Prime Minister of Spain (1996-2004); listed in Epstein's black book with NYC office at 8&8 Capital. His son-in-law Alejandro Agag (Formula E founder) also listed.,Jose Maria Aznar Lopez; Aznar; Jose Aznar,2,10,3,Yes,Spanish
Julie K. Brown,other,Miami Herald journalist whose reporting led to Epstein's 2019 arrest.,Brown; Julie Brown,0,137,3,No,American
Juror Number 50,associate,juror who gave press interviews after the verdict.,Juror 50,0,207,3,No,
